Title,Year,Important Words,Citations,Log_Citations,Quartile,Filtered Words,Novelty Score
Classification of Short Legal {L}ithuanian Texts,2015.0,"short legal lithuanian texts, classification",5.0,1.791759469228055,Q2,['classification'],0.6798061889686358
Proceedings of the Workshop Natural Language Processing for Translation Memories,2015.0,"workshop, natural language processing, translation memories",0.0,0.0,Q1,"['workshop', 'natural language processing', 'translation memories']",0.4200938764475087
Spotting false translation segments in translation memories,2015.0,"false translation segments, translation memories",12.0,2.5649493574615367,Q3,['translation memories'],0.1672627802133445
Improving translation memory fuzzy matching by paraphrasing,2015.0,"volume 31, inforex, paraphrasing",7.0,2.079441541679836,Q2,"['inforex', 'paraphrasing']",0.17254405827213132
{CAT}a{L}og: New Approaches to {TM} and Post Editing Interfaces,2015.0,"tm (translation memory), post-editing interface",12.0,2.5649493574615367,Q3,['tm (translation memory)'],0.0
Proceedings of {SLPAT} 2015: 6th Workshop on Speech and Language Processing for Assistive Technologies,2015.0,"slpat 2015, 6th workshop, spoken language processing, assistive technology",0.0,0.0,Q1,"['spoken language processing', 'assistive technology']",0.4180758464877072
"Talking Heads, Signing Avatars and Social Robots",2015.0,"talking heads, row, social robot",0.0,0.0,Q1,"['row', 'social robot']",0.32639899676644507
Bridging the gap between sign language machine translation and sign language animation using sequence classification,2015.0,"automatic categorization, sign language, sequence classifiers",15.0,2.772588722239781,Q3,['sign language'],0.7495106587645456
Synthesizing the finger alphabet of {S}wiss {G}erman Sign Language and evaluating the comprehensibility of the resulting animations,2015.0,"finger alphabet, german sign language, comprehensibility, animation, synthesised",7.0,2.079441541679836,Q2,"['german sign language', 'animation']",0.13658126009608046
Contour-based Hand Pose Recognition for Sign Language Recognition,2015.0,"contour-based hand pose recognition, sign language recognition",4.0,1.6094379124341005,Q2,['sign language recognition'],0.5193313793375325
Synthesizing and Evaluating Animations of {A}merican {S}ign {L}anguage Verbs Modeled from Motion-Capture Data,2015.0,"synthesised, evaluating, animation, american sign language verbs, modeled, motion-capture data",3.0,1.3862943611198906,Q2,"['evaluating', 'animation']",0.4034738764110633
Evaluating a Dynamic Time Warping Based Scoring Algorithm for Facial Expressions in {ASL} Animations,2015.0,"dynamic time warping, scoring algorithm, facial displays, asl animations",6.0,1.9459101490553128,Q2,['facial displays'],0.2781940501295044
Qualitative investigation of the display of speech recognition results for communication with deaf people,2015.0,"qualitative experiments, display of speech recognition results, communication, deaf people",7.0,2.079441541679836,Q2,['communication'],0.46057537270850013
Predicting disordered speech comprehensibility from Goodness of Pronunciation scores,2015.0,"disordered speech, goodness of pronunciation scores",4.0,1.6094379124341005,Q2,['disordered speech'],0.500280021060978
Recognizing Dysarthric Speech due to Amyotrophic Lateral Sclerosis with Across-Speaker Articulatory Normalization,2015.0,"dysarthric speech, amyotrophic lateral sclerosis, articulatory speaker normalisation",12.0,2.5649493574615367,Q3,['dysarthric speech'],0.4103215898027994
Automatic dysfluency detection in dysarthric speech using deep belief networks,2015.0,"fluency filtering, dysarthric speech, automatic, deep belief network",9.0,2.302585092994046,Q3,"['dysarthric speech', 'automatic', 'deep belief network']",0.33728332123253874
Model adaptation and adaptive training for the recognition of dysarthric speech,2015.0,"map adaptation, adaptive testing, recognition, dysarthric speech",13.0,2.6390573296152584,Q3,"['recognition', 'dysarthric speech']",0.4497089212705992
Pronunciation Adaptation For Disordered Speech Recognition Using State-Specific Vectors of Phone-Cluster Adaptive Training,2015.0,"pronunciation adaptation, disordered speech, state-specific vectors, phone-cluster adaptive training",4.0,1.6094379124341005,Q2,['disordered speech'],0.500280021060978
"Determining an Optimal Set of Flesh Points on Tongue, Lips, and Jaw for Continuous Silent Speech Recognition",2015.0,"optimal set, flesh points, tongue, lips, jaw, continuous speech",11.0,2.4849066497880004,Q3,"['tongue', 'lips', 'jaw', 'continuous speech']",0.22502269864393745
Analysis of Dysarthric Speech using Distinctive Feature Recognition,2015.0,"dysarthric speech, distinctive, analysis",5.0,1.791759469228055,Q2,"['dysarthric speech', 'distinctive', 'analysis']",0.37228704698279097
Generating acceptable {A}rabic Core Vocabularies and Symbols for {AAC} users,2015.0,"arabic core vocabularies, symbol, aac users",0.0,0.0,Q1,['symbol'],0.5787508684570974
Speech and language technologies for the automatic monitoring and training of cognitive functions,2015.0,"speech and language therapy, automatic reading, training, cognitive functions",3.0,1.3862943611198906,Q2,['training'],0.7092153066498224
Extending a {D}utch Text-to-Pictograph Converter to {E}nglish and {S}panish,2015.0,"dutch data-to-text system, english, spanish",4.0,1.6094379124341005,Q2,"['english', 'spanish']",0.4585754691599434
Individuality-Preserving Spectrum Modification for Articulation Disorders Using Phone Selective Synthesis,2015.0,"individuality-preserving spectrum modification, articulation disorders, phone selective synthesis",1.0,0.6931471805599453,Q1,['articulation disorders'],-0.11632349332190706
Recognition of Distress Calls in Distant Speech Setting: a Preliminary Experiment in a Smart Home,2015.0,"collocations, distant speech setting, preliminary test, smart home",5.0,1.791759469228055,Q2,['collocations'],0.24704469475344026
Using linguistic features longitudinally to predict clinical scores for {A}lzheimer{'}s disease and related dementias,2015.0,"experimenting, longitudinally, predict clinical scores, alzheimer's disease, related dementias",42.0,3.7612001156935615,Q4,"['experimenting', ""alzheimer's disease""]",0.3332155625612806
System Combination of {RBMT} plus {SPE} and Preordering plus {SMT},2015.0,"combined systems, rbmt (rule-based machine translation), spe (statistical post-editing), preordering, smt (statistical machine translation)",4.0,1.6094379124341005,Q2,"['rbmt (rule-based machine translation)', 'preordering', 'smt (statistical machine translation)']",0.3933714343378485
Neural Reranking Improves Subjective Quality of Machine Translation: {NAIST} at {WAT}2015,2015.0,"neural reranking, ambient, machine translate, naist, 2015",59.0,4.0943445622221,Q4,"['neural reranking', 'ambient', 'machine translate', 'naist', '2015']",0.34525785966287287
{NICT} at {WAT} 2015,2015.0,"nict, 2015",2.0,1.0986122886681098,Q1,"['nict', '2015']",0.5503894706228505
{NAVER} Machine Translation System for {WAT} 2015,2015.0,"naver, machine translation system, 2015",16.0,2.833213344056216,Q3,"['machine translation system', '2015']",0.43922837572085627
An Awkward Disparity between {BLEU} / {RIBES} Scores and Human Judgements in Machine Translation,2015.0,"bleu scores, ribes scores, human judgments, machine translate",12.0,2.5649493574615367,Q3,"['human judgments', 'machine translate']",0.7949067203544737
A Dependency-to-String Model for {C}hinese-{J}apanese {SMT} System,2015.0,"dependency-to-string model, chinese-to-japanese smt",1.0,0.6931471805599453,Q1,['dependency-to-string model'],-0.08582019547813902
Sampling-based Alignment and Hierarchical Sub-sentential Alignment in {C}hinese{--}{J}apanese Translation of Patents,2015.0,"gestuels, industrial initiative, voice dialog systems, patents",1.0,0.6931471805599453,Q1,['patents'],0.7680323173224803
{C}hinese-to-{J}apanese Patent Machine Translation based on Syntactic Pre-ordering for{WAT} 2015,2015.0,"patent machine translation, syntactic pre-ordering, forwat 2015",3.0,1.3862943611198906,Q2,['patent machine translation'],0.5303843074248642
Source Phrase Segmentation and Translation for {J}apanese-{E}nglish Translation Using Dependency Structure,2015.0,"source representations, translate, japanese-english translation, dependency structure",1.0,0.6931471805599453,Q1,"['translate', 'dependency structure']",0.3935304846426161
A Simple Surface Realization Engine for {T}elugu,2015.0,"surface realization, telugu",6.0,1.9459101490553128,Q2,"['surface realization', 'telugu']",0.6453491975164527
Input Seed Features for Guiding the Generation Process: A Statistical Approach for {S}panish,2015.0,"input seed features, lcm-pl, statistical approach, spanish",4.0,1.6094379124341005,Q2,"['statistical approach', 'spanish']",0.32551452822115656
A Domain Agnostic Approach to Verbalizing n-ary Events without Parallel Corpora,2015.0,"domain agnostic approach, verbalize, n-ary events, parallel corpora",0.0,0.0,Q1,['parallel corpora'],0.3021445135057508
Reading Times Predict the Quality of Generated Text Above and Beyond Human Ratings,2015.0,"reading time, food type extraction, human ratings",3.0,1.3862943611198906,Q2,"['reading time', 'human ratings']",0.7572830570180444
A Framework for the Generation of Computer System Diagnostics in Natural Language using Finite State Methods,2015.0,"framework, genesis, computer system diagnostics, raw speech, finite state methods",4.0,1.6094379124341005,Q2,"['framework', 'genesis', 'finite state methods']",0.21080901404846322
A Snapshot of {NLG} Evaluation Practices 2005 - 2014,2015.0,"nlg (natural language generation), evaluation trends, 2005, 2014",28.0,3.367295829986474,Q4,"['nlg (natural language generation)', '2005', '2014']",0.21262720514071506
{J}apanese Word Reordering Executed Concurrently with Dependency Parsing and Its Evaluation,2015.0,"japanese word, reordering, dependency parses, evaluate",0.0,0.0,Q1,"['japanese word', 'reordering', 'dependency parses', 'evaluate']",0.2526283387754573
Sentence Ordering in Electronic Navigational Chart Companion Text Generation,2015.0,"front end, electronic navigational chart, textgeneration",2.0,1.0986122886681098,Q1,['front end'],0.0
Translating {I}talian to {LIS} in the Rail Stations,2015.0,"italian, italian sign language, rail stations",1.0,0.6931471805599453,Q1,"['italian', 'italian sign language']",0.195347294241353
Response Generation in Dialogue Using a Tailored {PCFG} Parser,2015.0,"response generation, dialogue, pcfg parsing",3.0,1.3862943611198906,Q2,"['response generation', 'dialogue', 'pcfg parsing']",0.44098477025946253
Generating R{\'e}cit from Sensor Data: Evaluation of a Task Model for Story Planning and Preliminary Experiments with {GPS} Data,2015.0,"r'ecit, sensor data, task model, story plans, empirical facts, gps data",3.0,1.3862943611198906,Q2,['sensor data'],0.0005383917797175952
Generating and Evaluating Landmark-Based Navigation Instructions in Virtual Environments,2015.0,"landmark navigation instructions, virtual environment, generates, evaluating",5.0,1.791759469228055,Q2,"['virtual environment', 'evaluating']",0.27020806761246197
Generating Descriptions of Spatial Relations between Objects in Images,2015.0,"descriptions, spatial relations, objects, photo",5.0,1.791759469228055,Q2,"['descriptions', 'spatial relations', 'objects', 'photo']",0.5853643293035795
"Towards Flexible, Small-Domain Surface Generation: Combining Data-Driven and Grammatical Approaches",2015.0,"flexible, small-domain surface generation, data-driven approaches, grammatical approaches",0.0,0.0,Q1,"['flexible', 'data-driven approaches']",0.26158658625794756
{JS}real{B}: A Bilingual Text Realizer for Web Programming,2015.0,"jsrealb, bilingual text, web programming",12.0,2.5649493574615367,Q3,['bilingual text'],0.16169823341200473
A Game-Based Setup for Data Collection and Task-Based Evaluation of Uncertain Information Presentation,2015.0,"game-based setup, data capture, task-based evaluation, uncertain data",4.0,1.6094379124341005,Q2,['task-based evaluation'],0.03317242953241761
Generating Referential Descriptions Involving Relations by a Best-First Searching Procedure {--} A System Demo,2015.0,"referential descriptions, relation, language identifier, system demo",0.0,0.0,Q1,"['referential descriptions', 'relation', 'system demo']",0.3673976026284082
"Generating Image Descriptions with Gold Standard Visual Inputs: Motivation, Evaluation and Baselines",2015.0,"image senses, gold standard visual inputs, motivates, evaluate, baselines",11.0,2.4849066497880004,Q3,"['evaluate', 'baselines']",0.4621789635751121
Designing an Algorithm for Generating Named Spatial References,2015.0,"algorithm, spatial reference",9.0,2.302585092994046,Q3,"['algorithm', 'spatial reference']",0.33191057986824124
Topic Transition Strategies for an Information-Giving Agent,2015.0,"topic transition, information-giving agent",5.0,1.791759469228055,Q2,['topic transition'],0.09382799111267714
A Personal Storytelling about Your Favorite Data,2015.0,"word classes, data",4.0,1.6094379124341005,Q2,"['word classes', 'data']",0.3760078327366929
Interactions between Narrative Schemas and Document Categories,2015.0,"interactions, narrative schema, document categories",5.0,1.791759469228055,Q2,"['interactions', 'narrative schema']",0.5240098480132722
Improving Event Detection with {A}bstract {M}eaning {R}epresentation,2015.0,"event detection, abstract words",30.0,3.4339872044851463,Q4,['event detection'],0.8327747181190445
News clustering approach based on discourse text structure,2015.0,"news clustering approach, discourse structure",4.0,1.6094379124341005,Q2,['discourse structure'],0.3966641368288756
Expanding the horizons: adding a new language to the news personalization system,2015.0,"news personalization system, english",1.0,0.6931471805599453,Q1,['english'],0.4405624436103456
Storylines for structuring massive streams of news,2015.0,"storylines, structures, massive streams, news",34.0,3.555348061489413,Q4,"['storylines', 'structures', 'news']",0.5141324740765557
From {T}ime{L}ines to {S}tory{L}ines: A preliminary proposal for evaluating narratives,2015.0,"timelines, storylines, preliminary model, ",8.0,2.19722457733622,Q3,"['timelines', 'storylines']",0.4464172143939651
Cross-Document Non-Fiction Narrative Alignment,2015.0,"cross-document, non-fiction, narrative alignment",3.0,1.3862943611198906,Q2,"['cross-document', 'non-fiction']",0.43043165573410935
Proceedings of the 2nd Workshop on Natural Language Processing Techniques for Educational Applications,2015.0,"workshop, natural language processing methods, pedagogic usefulness",0.0,0.0,Q1,['workshop'],0.5322105174108568
{C}hinese Grammatical Error Diagnosis by Conditional Random Fields,2015.0,"chinese, grammar error detection, condition random fields",10.0,2.3978952727983707,Q3,['chinese'],0.3556185150085487
{NTOU} {C}hinese Grammar Checker for {CGED} Shared Task,2015.0,"ntou, chinese spell checker, cged shared task",7.0,2.079441541679836,Q2,['ntou'],0.33055489343104805
Collocation Assistant for Learners of {J}apanese as a Second Language,2015.0,"collocation, learners, japanese, second language",0.0,0.0,Q1,"['collocation', 'learners', 'japanese', 'second language']",0.39520237169759337
Semi-automatic Generation of Multiple-Choice Tests from Mentions of Semantic Relations,2015.0,"automated generation, multiple answers, mention, semantic relation",3.0,1.3862943611198906,Q2,"['automated generation', 'mention', 'semantic relation']",0.34628226262864503
Annotating Entailment Relations for Shortanswer Questions,2015.0,"entailment relations, short answers",2.0,1.0986122886681098,Q1,"['entailment relations', 'short answers']",0.140609715922569
An Automated Scoring Tool for {K}orean Supply-type Items Based on Semi-Supervised Learning,2015.0,"scoring tool, korean supply-type items, supervised data",0.0,0.0,Q1,['scoring tool'],-9.82836034779666e-12
A System for Generating Multiple Choice Questions: With a Novel Approach for Sentence Selection,2015.0,"system, multiple-choice question generation, novel approach, sentence selection",16.0,2.833213344056216,Q3,"['system', 'novel approach', 'sentence selection']",0.4310085630035032
The {``}News Web Easy{''} news service as a resource for teaching and learning {J}apanese: An assessment of the comprehension difficulty of {J}apanese sentence-end expressions,2015.0,"""news web easy"" news service, teaching, learning japanese, evaluate, comprehension, entity morphs",0.0,0.0,Q1,"['teaching', 'evaluate']",0.4385166819293846
Grammatical Error Correction Considering Multi-word Expressions,2015.0,"linguistic error correction, multiword expressions",1.0,0.6931471805599453,Q1,['multiword expressions'],0.5253418479815136
Salinlahi {III}: An Intelligent Tutoring System for {F}ilipino Heritage Language Learners,2015.0,"salinlahi iii, intelligent tutoring system, filipino",0.0,0.0,Q1,"['intelligent tutoring system', 'filipino']",0.16319161337380877
Using Finite State Transducers for Helping Foreign Language Learning,2015.0,"finite state transducers, private language learning",1.0,0.6931471805599453,Q1,['finite state transducers'],0.655742515077244
{C}hinese Grammatical Error Diagnosis Using Ensemble Learning,2015.0,"chinese grammar, diagnose, ensemble learning",18.0,2.9444389791664403,Q3,"['chinese grammar', 'diagnose']",0.5079618290081865
Improving {C}hinese Grammatical Error Correction with Corpus Augmentation and Hierarchical Phrase-based Statistical Machine Translation,2015.0,"chinese grammar, semantic maps, improve, hierarchical statistical machine translation",7.0,2.079441541679836,Q2,"['chinese grammar', 'improve']",0.319655692766053
{C}hinese Grammatical Error Diagnosis System Based on Hybrid Model,2015.0,"chinese grammatical error diagnosis system, hybrid model",6.0,1.9459101490553128,Q2,"['chinese grammatical error diagnosis system', 'hybrid model']",0.3040224712484814
Minority Language {T}witter: Part-of-Speech Tagging and Analysis of {I}rish Tweets,2015.0,"minority language, part-of-speech tagging, analysis, twittirish",26.0,3.295836866004329,Q4,"['minority language', 'part-of-speech tagging', 'analysis']",0.41280837807063264
Challenges of studying and processing dialects in social media,2015.0,"studies, process, dialect, social media",47.0,3.871201010907891,Q4,"['studies', 'process', 'dialect', 'social media']",0.5893388546331304
Toward Tweets Normalization Using Maximum Entropy,2015.0,"tweet, normalizer, maximum entropy",12.0,2.5649493574615367,Q3,"['tweet', 'maximum entropy']",0.424351767759587
Five Shades of Noise: Analyzing Machine Translation Errors in User-Generated Text,2015.0,"noise, mt4all, user-generated text",10.0,2.3978952727983707,Q3,"['noise', 'user-generated text']",0.7826954502125582
A Normalizer for {UGC} in {B}razilian {P}ortuguese,2015.0,"normalizer, ugc, brazilian portuguese",8.0,2.19722457733622,Q3,"['ugc', 'brazilian portuguese']",0.641932836169964
{USFD}: {T}witter {NER} with Drift Compensation and Linked Data,2015.0,"usfd, twitter ner, drift compensation, linked-data",12.0,2.5649493574615367,Q3,['usfd'],-2.220446049250313e-16
{NRC}: Infused Phrase Vectors for Named Entity Recognition in {T}witter,2015.0,"nrc, infused phrase vectors, named entity learning, twitter",10.0,2.3978952727983707,Q3,"['nrc', 'twitter']",0.546028294381784
{IITP}: Multiobjective Differential Evolution based {T}witter Named Entity Recognition,2015.0,"iitp, multiobjective optimization, twitter, named entity learning",8.0,2.19722457733622,Q3,"['iitp', 'twitter']",0.6685784032255386
Data Adaptation for Named Entity Recognition on Tweets with Features-Rich {CRF},2015.0,"data adaptation, named entity learning, tweet, features-rich crf",2.0,1.0986122886681098,Q1,['tweet'],0.8134528977534998
{H}allym: Named Entity Recognition on {T}witter with Word Representation,2015.0,"hallym, named entity learning, twitter, word representation",6.0,1.9459101490553128,Q2,"['twitter', 'word representation']",0.7140754348943156
{NCSU}-{SAS}-Ning: Candidate Generation and Feature Engineering for Supervised Lexical Normalization,2015.0,"ncsu, candidate generation, nepali social media, supervised lexical substitution",24.0,3.218875824868201,Q4,['candidate generation'],0.020137061126438982
{LYSGROUP}: Adapting a {S}panish microtext normalization system to {E}nglish.,2015.0,"lysgroup, spanish microtext normalization, english",8.0,2.19722457733622,Q3,['english'],0.4405624436103456
{IITP}: Hybrid Approach for Text Normalization in {T}witter,2015.0,"iitp, hybrid approach, text smoothing, twitter",15.0,2.772588722239781,Q3,"['iitp', 'hybrid approach', 'twitter']",0.5445482092189301
Enhancing Named Entity Recognition in {T}witter Messages Using Entity Linking,2015.0,"named entity learning, twitter messages, entity linkage",31.0,3.4657359027997265,Q4,['twitter messages'],0.028304757996625574
Improving {T}witter Named Entity Recognition using Word Representations,2015.0,"twitter, named entity learning, word representation",14.0,2.70805020110221,Q3,"['twitter', 'word representation']",0.7140754348943156
{NCSU}{\_}{SAS}{\_}{SAM}: Deep Encoding and Reconstruction for Normalization of Noisy Text,2015.0,"ncsu, deep encoding, reconstruction, normalizer, noisy-text",15.0,2.772588722239781,Q3,['reconstruction'],0.7443686160564692
Learning finite state word representations for unsupervised {T}witter adaptation of {POS} taggers,2015.0,"finite-state representation, unsupervised twitter adaptation, pos tagger",0.0,0.0,Q1,['pos tagger'],0.3178421808934586
Towards {POS} Tagging for {A}rabic Tweets,2015.0,"pos tagging, arabic tweets",2.0,1.0986122886681098,Q1,"['pos tagging', 'arabic tweets']",0.6298293207711806
Proceedings of the 4th Workshop on Linked Data in Linguistics: Resources and Applications,2015.0,"4th workshop, linked-data, linguistic, resource, application",0.0,0.0,Q1,"['4th workshop', 'linguistic', 'resource', 'application']",0.5245648941861247
From {DB}pedia and {W}ord{N}et hierarchies to {L}inked{I}n and {T}witter,2015.0,"dbpedia, wordnet hierarchy, linkedin, twitter",1.0,0.6931471805599453,Q1,"['dbpedia', 'twitter']",0.5616362382668287
A Linked Data Model for Multimodal Sentiment and Emotion Analysis,2015.0,"linked-data, bioki:enzymes, emotive",9.0,2.302585092994046,Q3,['emotive'],0.1518841482469978
Seeing is Correcting: curating lexical resources using social interfaces,2015.0,"curating, lexical sources, social interfaces",7.0,2.079441541679836,Q2,['curating'],0.04096081108085159
Sar-graphs: A Linked Linguistic Knowledge Resource Connecting Facts with Language,2015.0,"sar-graphs, lexical knowledge base, fact, english",5.0,1.791759469228055,Q2,"['lexical knowledge base', 'fact', 'english']",0.4044182264356336
Reconciling Heterogeneous Descriptions of Language Resources,2015.0,"heterogeneous descriptions, language resources",9.0,2.302585092994046,Q3,['language resources'],0.4107068389634452
{RDF} Representation of Licenses for Language Resources,2015.0,"rdf, licenses, language resources",27.0,3.332204510175204,Q4,"['rdf', 'language resources']",0.5248265336507139
{EVAL}ution 1.0: an Evolving Semantic Dataset for Training and Evaluation of Distributional Semantic Models,2015.0,"evalution 0, semantic dataset, training, evaluate, textes en fran\ccais",71.0,4.276666119016055,Q4,"['semantic dataset', 'training', 'evaluate']",0.3882788627876816
Linguistic Linked Data in {C}hinese: The Case of {C}hinese {W}ordnet,2015.0,"linguistic networks, chinese, chinese wordnet",5.0,1.791759469228055,Q2,"['chinese', 'chinese wordnet']",0.17736159751720693
Proceedings of the Fourth Workshop on Hybrid Approaches to Translation ({H}y{T}ra),2015.0,"5th workshop, hybrid approach, translate, hytra",0.0,0.0,Q1,"['5th workshop', 'hybrid approach', 'translate']",0.5295755697725056
Multi-system machine translation using online {API}s for {E}nglish-{L}atvian,2015.0,"cross system machine translation, online apis, english, latvian",5.0,1.791759469228055,Q2,"['english', 'latvian']",0.4155159115811411
What a Transfer-Based System Brings to the Combination with {PBMT},2015.0,"transfer system, combo, pbmt",6.0,1.9459101490553128,Q2,['transfer system'],1.1682204323903989e-06
Establishing sentential structure via realignments from small parallel corpora,2015.0,"sentential, re-aligning, small parallel corpus",0.0,0.0,Q1,['sentential'],0.29287533724874715
Passive and Pervasive Use of Bilingual Dictionary in Statistical Machine Translation,2015.0,"bilingual dictionary, lightweight models",4.0,1.6094379124341005,Q2,['bilingual dictionary'],0.21320563973337214
Automated Simultaneous Interpretation: Hints of a Cognitive Framework for Machine Translation,2015.0,"automatic interpretation system, cognitive models, machine translate",0.0,0.0,Q1,"['cognitive models', 'machine translate']",0.7678196667831512
A fuzzier approach to machine translation evaluation: A pilot study on post-editing productivity and automated metrics in commercial settings,2015.0,"fuzzy use, machine translation evaluation, pilot study, post-editor productivity, automated metrics, commercial systems",10.0,2.3978952727983707,Q3,"['machine translation evaluation', 'pilot study', 'automated metrics']",0.39144609358056504
A Methodology for Bilingual Lexicon Extraction from Comparable Corpora,2015.0,"methodology, bilingual lexical access, comparable corpora",1.0,0.6931471805599453,Q1,"['methodology', 'comparable corpora']",0.2439422236327407
Ongoing Study for Enhancing {C}hinese-{S}panish Translation with Morphology Strategies,2015.0,"spanish translation, morphology strategies, study",2.0,1.0986122886681098,Q1,"['spanish translation', 'study']",0.2818898737017278
{B}aidu Translate: Research and Products,2015.0,"baidu, research, product",9.0,2.302585092994046,Q3,"['baidu', 'research', 'product']",0.3909841800170404
