Title,Year,Important Words,Citations,Log_Citations,Quartile,Filtered Words,Novelty Score
Feature Selection in Kernel Space: A Case Study on Dependency Parsing,2015.0,"feature selection, kernel space, casestudy, dependency parses",1.0,0.6931471805599453,Q1,"['feature selection', 'dependency parses']",0.1761314941621031
Semantic Role Labeling Improves Incremental Parsing,2015.0,"semantic case role, incremental parsing",5.0,1.791759469228055,Q2,['incremental parsing'],0.006752094608673653
Discontinuous Incremental Shift-reduce Parsing,2015.0,"discontinuity, buffered shift-reduce parsing",27.0,3.332204510175204,Q4,['discontinuity'],0.001277665602545608
A Neural Probabilistic Structured-Prediction Model for Transition-Based Dependency Parsing,2015.0,"neural predictions, joint dependency parsing",85.0,4.454347296253507,Q4,['joint dependency parsing'],0.0007394067948526262
Parsing Paraphrases with Joint Inference,2015.0,"parses, paraphrase, joint inference",7.0,2.079441541679836,Q2,"['parses', 'paraphrase', 'joint inference']",0.3331124297035814
Cross-lingual Dependency Parsing Based on Distributed Representations,2015.0,"cross-lingual dependency parsing, distributed representation",147.0,4.997212273764115,Q4,"['cross-lingual dependency parsing', 'distributed representation']",0.790032747834946
Can Natural Language Processing Become Natural Language Coaching?,2015.0,"natural language processing, natural language coaching",11.0,2.4849066497880004,Q3,['natural language processing'],0.5608083317183246
Implicit Role Linking on {C}hinese Discourse: Exploiting Explicit Roles and Frame-to-Frame Relations,2015.0,"implicit role binding, chinese discourse, explicit roles, frame relatedness",3.0,1.3862943611198906,Q2,['chinese discourse'],0.7052955096460622
Discourse-sensitive Automatic Identification of Generic Expressions,2015.0,"discourse-aware, automatic identification, generic expressions",16.0,2.833213344056216,Q3,['automatic identification'],0.31702692079137273
Model-based Word Embeddings from Decompositions of Count Matrices,2015.0,"word embedding model, decompositions of count matrices",54.0,4.007333185232471,Q4,['word embedding model'],0.8294913540307254
Entity Hierarchy Embedding,2015.0,"entity, hierarchy embedding",54.0,4.007333185232471,Q4,['entity'],0.6556572759185872
Orthogonality of Syntax and Semantics within Distributional Spaces,2015.0,"orthogonality, syntax, semantics, distributional space",11.0,2.4849066497880004,Q3,"['orthogonality', 'syntax', 'semantics', 'distributional space']",0.28796641652141863
Scalable Semantic Parsing with Partial Ontologies,2015.0,"agent-based approach, ontologies",31.0,3.4657359027997265,Q4,['ontologies'],0.22254375419440664
Semantic Parsing via Staged Query Graph Generation: Question Answering with Knowledge Base,2015.0,"semantic parses, staged query graph generation, localising, knowledge bank",440.0,6.089044875446846,Q4,['knowledge bank'],0.0
Predicting Polarities of Tweets by Composing Word Embeddings with Long Short-Term Memory,2015.0,"polarities of tweets, word embeddings, short-term memory",188.0,5.241747015059643,Q4,"['word embeddings', 'short-term memory']",0.848129994157407
Topic Modeling based Sentiment Analysis on Social Media for Stock Market Prediction,2015.0,"topic modeling, sentiment analysis, social media, user study",115.0,4.7535901911063645,Q4,"['topic modeling', 'sentiment analysis', 'social media', 'user study']",0.7345064741173196
Learning Tag Embeddings and Tag-specific Composition Functions in Recursive Neural Network,2015.0,"tag embeddings, composition functions, recursive neural network",54.0,4.007333185232471,Q4,"['composition functions', 'recursive neural network']",0.2764154058028071
A convex and feature-rich discriminative approach to dependency grammar induction,2015.0,"convex, feature-rich, grammar rule induction",19.0,2.995732273553991,Q3,"['convex', 'feature-rich']",0.46946336216471074
Probing the Linguistic Strengths and Limitations of Unsupervised Grammar Induction,2015.0,"linguistic strengths, constraint, unsupervised formal grammar",13.0,2.6390573296152584,Q3,['constraint'],0.2485444601684832
Learning Anaphoricity and Antecedent Ranking Features for Coreference Resolution,2015.0,"learn, anaphoricity, antecedent ranking features, coreference decisions",105.0,4.663439094112067,Q4,"['learn', 'anaphoricity']",0.4167084362856427
Transferring Coreference Resolvers with Posterior Regularization,2015.0,"coreference resolvers, posterior regularization",16.0,2.833213344056216,Q3,"['coreference resolvers', 'posterior regularization']",-0.007638859651975083
Tea Party in the House: A Hierarchical Ideal Point Topic Model and Its Application to Republican Legislators in the 112th Congress,2015.0,"tea party, hierarchical topic model, veridicality, 112th congress",42.0,3.7612001156935615,Q4,['veridicality'],0.722618704882804
"{KB}-{LDA}: Jointly Learning a Knowledge Base of Hierarchy, Relations, and Facts",2015.0,"kb-lda, knowledge bank, hierarchy, relation, fact",14.0,2.70805020110221,Q3,"['knowledge bank', 'hierarchy', 'relation', 'fact']",0.4365058593033585
A Computationally Efficient Algorithm for Learning Topical Collocation Models,2015.0,"computationally feasible, learn, numeric attributes",2.0,1.0986122886681098,Q1,"['learn', 'numeric attributes']",0.687757619856932
Compositional Semantic Parsing on Semi-Structured Tables,2015.0,"compositional semantic parser, semi-structured data",263.0,5.575949103146316,Q4,['semi-structured data'],0.8187299302871691
Graph parsing with s-graph grammars,2015.0,"graph parsing, s-graph grammars",27.0,3.332204510175204,Q4,['graph parsing'],0.8943865319525905
Adding Semantics to Data-Driven Paraphrasing,2015.0,"semantics, discourse resource",53.0,3.9889840465642745,Q4,"['semantics', 'discourse resource']",0.17390763515175178
Parsing as Reduction,2015.0,"parses, reducts",44.0,3.80666248977032,Q4,['parses'],0.20479405359492175
Optimal Shift-Reduce Constituent Parsing with Structured Perceptron,2015.0,"shift-reduce, constituent syntax, structured perceptron",10.0,2.3978952727983707,Q3,"['shift-reduce', 'structured perceptron']",0.3213879411347587
"A Data-Driven, Factorization Parser for {CCG} Dependency Structures",2015.0,"data-driven, factorization parser, ccg structures",10.0,2.3978952727983707,Q3,['data-driven'],0.4758404151537041
Abstractive Multi-Document Summarization via Phrase Selection and Merging,2015.0,"abstractive multi-document summarization, phrase selection, merging",104.0,4.653960350157523,Q4,"['abstractive multi-document summarization', 'phrase selection', 'merging']",0.5436157283569849
Joint Graphical Models for Date Selection in Timeline Summarization,2015.0,"cross-graph model, date selection, chart summarization",17.0,2.8903717578961645,Q3,['date selection'],0.014990293378263964
A Frame of Mind: Using Statistical Models for Detection of Framing and Agenda Setting Campaigns,2015.0,"statistic models, detecting, framing, agenda setting campaigns",67.0,4.219507705176107,Q4,['detecting'],0.662662797931864
Why discourse affects speakers{'} choice of referring expressions,2015.0,"discourse, speakers, relative pronouns",21.0,3.091042453358316,Q4,"['discourse', 'speakers']",0.5332108881086237
Linguistic Harbingers of Betrayal: A Case Study on an Online Strategy Game,2015.0,"linguistic harbingers of betrayal, ccg parser",23.0,3.1780538303479458,Q4,['ccg parser'],0.3948000353160379
Who caught a cold ? - Identifying the subject of a symptom,2015.0,"cold, subject of a symptom",13.0,2.6390573296152584,Q3,['cold'],0.8937138608737136
Weakly Supervised Role Identification in Teamwork Interactions,2015.0,"weakly supervised, identity, teamwork",17.0,2.8903717578961645,Q3,['weakly supervised'],0.73781375742723
{SOLAR}: Scalable Online Learning Algorithms for Ranking,2015.0,"solar, scalable online training, ranking",11.0,2.4849066497880004,Q3,['ranking'],0.49463521168771574
Text Categorization as a Graph Classification Problem,2015.0,"classifying texts, error classification",59.0,4.0943445622221,Q4,['error classification'],0.6012109671388802
Inverted indexing for cross-lingual {NLP},2015.0,"inverted index, cross-lingual nlp (natural language processing)",81.0,4.406719247264253,Q4,['inverted index'],-0.0040585419193566175
Accurate Linear-Time {C}hinese Word Segmentation via Embedding Matching,2015.0,"linear-time, chronus system, embedding matching",32.0,3.49650756146648,Q4,['linear-time'],0.5713856427131498
Tracking unbounded Topic Streams,2015.0,"unbounded topic streams, track",7.0,2.079441541679836,Q2,['track'],0.7656910239684551
Inducing Word and Part-of-Speech with {P}itman-{Y}or Hidden Semi-{M}arkov Models,2015.0,"word, part-of-speech, pitman-yor semi-markov model",17.0,2.8903717578961645,Q3,"['word', 'part-of-speech']",0.45895530876732704
Coupled Sequence Labeling on Heterogeneous Annotations: {POS} Tagging as a Case Study,2015.0,"coupled sequence labeling, homogeneous annotations, pos tagging, casestudy",21.0,3.091042453358316,Q4,['pos tagging'],0.4239722693362943
{A}uto{E}xtend: Extending Word Embeddings to Embeddings for Synsets and Lexemes,2015.0,"word embeddings, multi-view, synset, lexemes",240.0,5.484796933490655,Q4,"['word embeddings', 'multi-view', 'synset', 'lexemes']",0.5030036405567928
Improving Evaluation of Machine Translation Quality Estimation,2015.0,"evaluate, machine translation quality estimation",38.0,3.6635616461296463,Q4,"['evaluate', 'machine translation quality estimation']",0.4589658358902129
~cY~BmZRZ{m(Exploring Word Embedding and Concept Information for Language Model Adaptation in {M}andarin Large Vocabulary Continuous Speech Recognition) [In {C}hinese],2015.0,"word embedding, concept information, language model adaptation, mandarin, large-vocabulary continuous speech recognition",0.0,0.0,Q1,"['word embedding', 'language model adaptation', 'mandarin', 'large-vocabulary continuous speech recognition']",0.4764624199226286
ZlZo{ (Smart Toneless {P}inyin Input Method for {H}akka Based on Natural Language Processing) [In {C}hinese],2015.0,"smart toneless pinyin input method, hakka, natural language processing",0.0,0.0,Q1,"['hakka', 'natural language processing']",0.39361319673279715
"cLWc(Textual Analysis of Complete Tang Poems for Discoveries and Applications - Style, Antitheses, Social Networks, and Couplets)[In {C}hinese]",2015.0,"textual analysis, complete tang poems, discovery, application, css, antitheses, social network, couplets",1.0,0.6931471805599453,Q1,"['textual analysis', 'discovery', 'application', 'css', 'social network']",0.40357017111082066
Designing a Tag-Based Statistical Math Word Problem Solver with Reasoning and Explanation,2015.0,"tag-based english math word problem solver, reasoning, explanation",10.0,2.3978952727983707,Q3,['explanation'],0.8898488762973094
Explanation Generation for a Math Word Problem Solver,2015.0,"explanation generation, math word problem solver",0.0,0.0,Q1,"['explanation generation', 'math word problem solver']",0.46238305328425394
xAyWZnx(A Study of Readability Prediction on Elementary and Secondary {C}hinese Textbooks and Excellent Extracurricular Reading Materials) [In {C}hinese],2015.0,"readability prediction, elementary and secondary chinese textbooks, excellent extracurricular reading materials",3.0,1.3862943611198906,Q2,['readability prediction'],0.001805778118762813
Zc (A {B}ayesian approach to determine move tags in corpus) [In {C}hinese],2015.0,"bayesian approach, move tags, corpus",1.0,0.6931471805599453,Q1,"['bayesian approach', 'corpus']",0.28486536948290847
{lVZR(Several Refinements of Modulation Spectrum Factorization for Robust Speech Recognition) [In {C}hinese],2015.0,"refinement, modulation spectrum factorization, noise robust",1.0,0.6931471805599453,Q1,"['refinement', 'modulation spectrum factorization']",0.2010333030548146
NWWcgAZe`lzy(Exploring Combinations of Various Deep Neural Network based Acoustic Models and Classification Techniques for {M}andarin Mispro-nunciation Detection)[In {C}hinese],2015.0,"combinations, various deep neural network, acoustic model, classification method, mandarin mis-pronunciation detection",0.0,0.0,Q1,"['combinations', 'acoustic model']",0.3289005976703357
WYhyZR(Automatic Speech Recognition using Neural Network based Acoustic Model with the Environment Clustering and Mixture of Experts Algorithms) [In {C}hinese],2015.0,"automatic speech recognition, neural system, acoustic model, environment clustering, mixture of experts algorithms",0.0,0.0,Q1,"['automatic speech recognition', 'acoustic model']",0.5085233479617185
QYWwR(A Tool for Web {NER} Model Generation Using Search Snippets of Known Entities) [In {C}hinese],2015.0,"web ner model, snippets, entity names",2.0,1.0986122886681098,Q1,"['snippets', 'entity names']",0.01342905797887578
Word Co-occurrence Augmented Topic Model in Short Text,2015.0,"word cooccurrence, topic model, short text",1.0,0.6931471805599453,Q1,"['word cooccurrence', 'topic model', 'short text']",0.4245499302592129
 {W}ord2{V}ec ~Ww(Matching {I}nternet Mood Essays with Pop-Music Based on {W}ord2{V}ec)[In {C}hinese],2015.0,"word2vec, internet mood essays, pop-music",0.0,0.0,Q1,['word2vec'],0.6719179661424036
(New Editing and Checking Work of the Semantic Knowledge Base of Contemporary {C}hinese ({SKCC}))[In {C}hinese],2015.0,semantic memory,0.0,0.0,Q1,['semantic memory'],2.3233073215611633e-05
ZW(Analyzing Learners {`}Writing Fluency Based on Language Model)[In {C}hinese],2015.0,"learners, reading fluency, language model",1.0,0.6931471805599453,Q1,"['learners', 'language model']",0.6615643927086705
The word complexity measure ({WCM}) in early phonological development: A longitudinal study from birth to three years old,2015.0,"word complexity measure (wcm), syntactic development, longitudinal study, birth, three years on",1.0,0.6931471805599453,Q1,"['syntactic development', 'longitudinal study', 'birth']",-2.055791652651647e-05
Learning Knowledge from User Search,2015.0,"knowledge, user search",0.0,0.0,Q1,['knowledge'],0.7230425433594506
ndAcAy(Analysis and Prediction of Blogger{'}s Depression Tendency)[In {C}hinese],2015.0,"blogger's depression tendency, analysis, predict",1.0,0.6931471805599453,Q1,"['analysis', 'predict']",0.6546786776057079
\{P}ythonYZRg(A Python Implementation of Automatic Speech-text Synchronization Using Speech Recognition and Text-to-Speech Technology)[In {C}hinese],2015.0,"python, event recognizer, speech recognition, end-to-end tts",0.0,0.0,Q1,['speech recognition'],0.33614462894902764
YBZwR(Speech Emotion Recognition via Nonlinear Dynamical Features)[In {C}hinese],2015.0,"speech act recognition, non-linear features",1.0,0.6931471805599453,Q1,['speech act recognition'],-2.17930698687141e-05
Proceedings of the 2015 Conference of the North {A}merican Chapter of the Association for Computational Linguistics: Tutorial Abstracts,2015.0,"2015 conference, north american chapter, retrospection, paper abstract",0.0,0.0,Q1,['north american chapter'],0.461430912239407
Hands-on Learning to Search for Structured Prediction,2015.0,"hands-on learning, search, category name",0.0,0.0,Q1,"['search', 'category name']",0.5181619560346387
"The Logic of {AMR}: Practical, Unified, Graph-Based Sentence Semantics for {NLP}",2015.0,"amr, graph-based semantics, speakers' anger utterance, logic, unified",3.0,1.3862943611198906,Q2,"['logic', 'unified']",0.5828709289528959
Deep Learning and Continuous Representations for Natural Language Processing,2015.0,"news, continuous representation, natural language processing",1.0,0.6931471805599453,Q1,"['news', 'continuous representation', 'natural language processing']",0.47627715774582463
Social Media Predictive Analytics,2015.0,"social media, predictive model",6.0,1.9459101490553128,Q2,"['social media', 'predictive model']",0.44795118390538824
Getting the Roles Right: Using {F}rame{N}et in {NLP},2015.0,"role, framenet, speakers' anger utterance",4.0,1.6094379124341005,Q2,"['role', 'framenet']",0.43909775322166084
Proceedings of the 2015 Conference of the North {A}merican Chapter of the Association for Computational Linguistics: Demonstrations,2015.0,"2015 conference, north american chapter, retrospection, worry",0.0,0.0,Q1,['north american chapter'],0.461430912239407
Analyzing and Visualizing Coreference Resolution Errors,2015.0,"analyses, visualizing, coreference decisions",10.0,2.3978952727983707,Q3,"['analyses', 'visualizing']",0.4626329099136675
"hyp: A Toolkit for Representing, Manipulating, and Optimizing Hypergraphs",2015.0,"hyp, toolkit, representing, manipulating, optimizing, hypergraphs",0.0,0.0,Q1,"['hyp', 'toolkit', 'representing', 'manipulating', 'optimizing', 'hypergraphs']",0.4216109848072254
Enhancing Instructor-Student and Student-Student Interactions with Mobile Interfaces and Summarization,2015.0,"syntactic flexibility, syntactic flexibility, mobile interfaces, summarization",14.0,2.70805020110221,Q3,['summarization'],0.695129837574255
{RE}xtractor: a Robust Information Extractor,2015.0,"rextractor, term extractor",8.0,2.19722457733622,Q3,['term extractor'],1.2212453270876722e-15
"An {AMR} parser for {E}nglish, {F}rench, {G}erman, {S}panish and {J}apanese and a new {AMR}-annotated corpus",2015.0,"amr parser, english, french, german, spanish, japanese, amr-annotated corpus",40.0,3.713572066704308,Q4,"['amr parser', 'english', 'french', 'german', 'spanish', 'japanese']",0.40073076457296986
{ICE}: Rapid Information Extraction Customization for {NLP} Novices,2015.0,"ice, lexical composition, customizing, speakers' anger utterance, novice",16.0,2.833213344056216,Q3,"['ice', 'customizing', 'novice']",0.3307968503967131
{C}kylark: A More Robust {PCFG}-{LA} Parser,2015.0,"ckylark, pcfg parsing",15.0,2.772588722239781,Q3,['pcfg parsing'],-0.0003769181807280475
{SETS}: Scalable and Efficient Tree Search in Dependency Graphs,2015.0,"set, scalable, efficient tree search, dependency graph",12.0,2.5649493574615367,Q3,"['set', 'scalable', 'dependency graph']",0.6467371624511898
Visualizing Deep-Syntactic Parser Output,2015.0,"deep-syntactic parsing, visualizing",1.0,0.6931471805599453,Q1,['visualizing'],0.4349053859605915
Lean Question Answering over {F}reebase from Scratch,2015.0,"lean question answering, freebase, scratch",60.0,4.110873864173311,Q4,"['freebase', 'scratch']",0.5090001427919517
A Web Application for Automated Dialect Analysis,2015.0,"web app, automated dialect analysis",16.0,2.833213344056216,Q3,['web app'],0.28994229455716136
An Open-source Framework for Multi-level Semantic Similarity Measurement,2015.0,"open-source framework, semantic metrics",3.0,1.3862943611198906,Q2,['open-source framework'],7.828182546631979e-13
Brahmi-Net: A transliteration and script conversion system for languages of the {I}ndian subcontinent,2015.0,"brahmi-net, transliteration, text conversion system, languages, indian subcontinent",23.0,3.1780538303479458,Q4,"['transliteration', 'languages']",0.4082524530542646
A Concrete {C}hinese {NLP} Pipeline,2015.0,chinese nlp,2.0,1.0986122886681098,Q1,['chinese nlp'],1.3053624403625008e-08
Online Readability and Text Complexity Analysis with {T}ext{E}valuator,2015.0,"web readability, text complexity, textevaluator",16.0,2.833213344056216,Q3,['text complexity'],0.3571780167137748
Natural Language Question Answering and Analytics for Diverse and Interlinked Datasets,2015.0,"natural language questions, analytics, diverse dataset, interlinked datasets",12.0,2.5649493574615367,Q3,"['natural language questions', 'analytics']",0.3722672995722588
{W}rite{A}head2: Mining Lexical Grammar Patterns for Assisted Writing,2015.0,"writeahead2, mining, generation-distillation, assisted writing",8.0,2.19722457733622,Q3,"['mining', 'assisted writing']",0.3167054346313149
Question Answering System using Multiple Information Source and Open Type Answer Merge,2015.0,"transcheck system, source of knowledge, open type answer merge",7.0,2.079441541679836,Q2,['transcheck system'],-0.000858380508518497
Using Word Semantics To Assist {E}nglish as a Second Language Learners,2015.0,"verb semantic, medieval arabic literature",9.0,2.302585092994046,Q3,['verb semantic'],0.003661700773595844
Proceedings of the 2015 Conference of the North {A}merican Chapter of the Association for Computational Linguistics: Student Research Workshop,2015.0,"2015 conference, north american chapter, retrospection, student research workshop",0.0,0.0,Q1,"['north american chapter', 'student research workshop']",0.46151060327418647
Cache-Augmented Latent Topic Language Models for Speech Retrieval,2015.0,"cache-augmented latent topic language models, speech retrieval",0.0,0.0,Q1,['speech retrieval'],-1.1205776538902867e-05
Relation extraction pattern ranking using word similarity,2015.0,"relation extraction, patternrank, word similarity",1.0,0.6931471805599453,Q1,"['relation extraction', 'word similarity']",0.6802531223864399
Towards a Better Semantic Role Labeling of Complex Predicates,2015.0,"semantic case role, complex predicates",4.0,1.6094379124341005,Q2,['complex predicates'],0.36912321904205614
Exploring Relational Features and Learning under Distant Supervision for Information Extraction Tasks,2015.0,"related attributes, distant supervision, information extraction task",0.0,0.0,Q1,"['distant supervision', 'information extraction task']",0.37623027272240145
Entity/Event-Level Sentiment Detection and Inference,2015.0,"entity, event-level sentiment detection, inference",3.0,1.3862943611198906,Q2,"['entity', 'inference']",0.6539229669374375
Initial Steps for Building a Lexicon of Adjectives with Scalemates,2015.0,"lexicon, adjectives, scalemates",0.0,0.0,Q1,"['lexicon', 'adjectives']",0.353005102689477
A Preliminary Evaluation of the Impact of Syntactic Structure in Semantic Textual Similarity and Semantic Relatedness Tasks,2015.0,"pre-evaluation, impact, syntactic structure, semantic text similarity, averaging",1.0,0.6931471805599453,Q1,"['impact', 'syntactic structure', 'semantic text similarity']",0.36696136780260863
Benchmarking Machine Translated Sentiment Analysis for {A}rabic Tweets,2015.0,"machine translated text detection, arabic tweets, benchmarking",18.0,2.9444389791664403,Q3,"['arabic tweets', 'benchmarking']",0.7742998960693017
Learning Kernels for Semantic Clustering: A Deep Approach,2015.0,"learning kernels, 22e \'edition), deep approach",3.0,1.3862943611198906,Q2,['deep approach'],0.25029056404955885
Relation Extraction from Community Generated Question-Answer Pairs,2015.0,"relation extraction, franais (french)",10.0,2.3978952727983707,Q3,['relation extraction'],0.78076503492682
Detecting Translation Direction: A Cross-Domain Study,2015.0,"translation direction, cross-domain study",5.0,1.791759469228055,Q2,['translation direction'],0.3934343076020005
Improving the Translation of Discourse Markers for {C}hinese into {E}nglish,2015.0,"translate, discourse marking, chinese, english",8.0,2.19722457733622,Q3,"['translate', 'chinese', 'english']",0.4271431513953174
Discourse and Document-level Information for Evaluating Language Output Tasks,2015.0,"discourse, document-level information, evaluating language output tasks",6.0,1.9459101490553128,Q2,"['discourse', 'document-level information']",0.2605162369618351
Speeding Document Annotation with Topic Models,2015.0,"document annotation, topic model",0.0,0.0,Q1,"['document annotation', 'topic model']",0.2715271383637503
Lifelong Machine Learning for Topic Modeling and Beyond,2015.0,"lifelong machine learning, topic modeling",5.0,1.791759469228055,Q2,['topic modeling'],0.7173158034636113
Semantics-based Graph Approach to Complex Question-Answering,2015.0,"semantics, graph approach, complex question-answering",2.0,1.0986122886681098,Q1,"['semantics', 'graph approach']",0.17729766992929097
Recognizing Textual Entailment using Dependency Analysis and Machine Learning,2015.0,"textual entailment, dependency analysis, machine-learning",7.0,2.079441541679836,Q2,"['textual entailment', 'dependency analysis']",0.19749573167064793
Bilingual lexicon extraction for a distant language pair using a small parallel corpus,2015.0,"bilingual lexica, extraction, distant language pair, small parallel corpus",6.0,1.9459101490553128,Q2,"['extraction', 'distant language pair']",0.47647377095613985
Computational Exploration to Linguistic Structures of Future: Classification and Categorization,2015.0,"computational exploration, linguistic structures, future, classification, categorize",2.0,1.0986122886681098,Q1,"['computational exploration', 'linguistic structures', 'future', 'classification']",0.32147324093765395
Proceedings of the 2015 Conference of the North {A}merican Chapter of the Association for Computational Linguistics: Human Language Technologies,2015.0,"2015 conference, north american chapter, retrospection, human language technologies",0.0,0.0,Q1,"['north american chapter', 'human language technologies']",0.4342679372957993
Unsupervised Induction of Semantic Roles within a Reconstruction-Error Minimization Framework,2015.0,"unsupervised induction, semantic roles, reconstruction-error minimization framework",27.0,3.332204510175204,Q4,"['unsupervised induction', 'semantic roles']",0.16904216358841084
Improving unsupervised vector-space thematic fit evaluation via role-filler prototype clustering,2015.0,"unsupervised vector-space, thematic fit, role-filler prototype clustering",24.0,3.218875824868201,Q4,['thematic fit'],0.44705301583923673
A Compositional and Interpretable Semantic Space,2015.0,"compositional, interpretable semantic space",53.0,3.9889840465642745,Q4,['compositional'],0.6405676218385362
"Randomized Greedy Inference for Joint Segmentation, {POS} Tagging and Dependency Parsing",2015.0,"greedy inference, joint segmentation, pos tagging, dependency parses",33.0,3.5263605246161616,Q4,"['joint segmentation', 'pos tagging', 'dependency parses']",0.2376222823974756
