Title,Year,Important Words,Citations,Log_Citations,Quartile,Filtered Words,Novelty Score
Semantic Interoperability for Cross-lingual and cross-document Event Detection,2015.0,"semantic interoperability, crosslingual, cross-document event",1.0,0.6931471805599453,Q1,"['semantic interoperability', 'crosslingual', 'cross-document event']",0.49842759030678013
Modeling and Characterizing Social Media Topics Using the Gamma Distribution,2015.0,"term resource, gamma distribution, modeled, characterizing",2.0,1.0986122886681098,Q1,['characterizing'],-0.0014046204440707477
Proceedings of the Fourth Workshop on Computational Linguistics for Literature,2015.0,"5th workshop, organisation, literature",0.0,0.0,Q1,"['5th workshop', 'organisation', 'literature']",0.48620525407859877
Rhetorical Figure Detection: the Case of Chiasmus,2015.0,"rhetoric figures, chiasmus",18.0,2.9444389791664403,Q3,['chiasmus'],-0.1668956107042865
Validating Literary Theories Using Automatic Social Network Extraction,2015.0,"literary theories, social network extraction",20.0,3.044522437723423,Q4,['social network extraction'],2.875835671822813e-07
{G}uten{T}ag: an {NLP}-driven Tool for Digital Humanities Research in the {P}roject {G}utenberg Corpus,2015.0,"gutentag, speakers' anger utterance, digital humanities, project gutenberg corpus",30.0,3.4339872044851463,Q4,['digital humanities'],0.7911655493515348
A Pilot Experiment on Exploiting Translations for Literary Studies on Kafka{'}s {``}Verwandlung{''},2015.0,"pilot task, translations, literary study, kafka's ""verwandlung""",1.0,0.6931471805599453,Q1,['translations'],0.35995016916810485
Identifying Literary Texts with Bigrams,2015.0,"literary text, bigrams",7.0,2.079441541679836,Q2,"['literary text', 'bigrams']",0.4423105655429108
"Gender-Based Vocation Identification in {S}wedish 19th Century Prose Fiction using Linguistic Patterns, {NER} and {CRF} Learning",2015.0,"gender-based vocation identification, 19th century swedish literature, autoparse, named-entity recognition, crf (conditional random fields)",1.0,0.6931471805599453,Q1,"['named-entity recognition', 'crf (conditional random fields)']",0.49713795613515954
A computational linguistic approach to {S}panish Golden Age Sonnets: metrical and semantic aspects,2015.0,"computational linguistic approach, spanish sonnets, metrical aspects, semantic aspects",4.0,1.6094379124341005,Q2,['semantic aspects'],0.03979195207217601
Automated Translation of a Literary Work: A Pilot Study,2015.0,"automated translation, literary, pilot study",11.0,2.4849066497880004,Q3,"['automated translation', 'literary', 'pilot study']",0.4468850110054285
Translating Literary Text between Related Languages using {SMT},2015.0,"literary text, lemmatag, smt (statistical machine translation)",13.0,2.6390573296152584,Q3,"['literary text', 'smt (statistical machine translation)']",0.3878701938936924
Candidate evaluation strategies for improved difficulty prediction of language tests,2015.0,"candidate evaluation strategies, difficulty estimation, language tests",5.0,1.791759469228055,Q2,"['difficulty estimation', 'language tests']",0.007092728769301115
Feature selection for automated speech scoring,2015.0,"feature selection, automated speech scoring",2.0,1.0986122886681098,Q1,"['feature selection', 'automated speech scoring']",0.17304534589071302
Incorporating Coherence of Topics as a Criterion in Automatic Response-to-Text Assessment of the Organization of Writing,2015.0,"thematic cohesion, criterion, response-to-text assessment, organization of writing",7.0,2.079441541679836,Q2,['criterion'],-0.008981350488687978
Automatic morphological analysis of learner {H}ungarian,2015.0,"automatic morphological analysis, learner hungarian",2.0,1.0986122886681098,Q1,['automatic morphological analysis'],-4.1982821476604926e-05
Automated Scoring of Picture-based Story Narration,2015.0,"automated scoring, visual story",19.0,2.995732273553991,Q3,['automated scoring'],0.7030678811071758
Scoring Persuasive Essays Using Opinions and their Targets,2015.0,"persuasive, opinion, target",30.0,3.4339872044851463,Q4,"['persuasive', 'opinion', 'target']",0.7023651616651051
The Impact of Training Data on Automated Short Answer Scoring Performance,2015.0,"training data, loonybin",24.0,3.218875824868201,Q4,['training data'],0.6372741513868776
Interpreting Questions with a Log-Linear Ranking Model in a Virtual Patient Dialogue System,2015.0,"question, compiler system, 20 languages",6.0,1.9459101490553128,Q2,['question'],0.7693986067244701
Identifying Patterns For Short Answer Scoring Using Graph-based Lexico-Semantic Text Matching,2015.0,"pattern, short answer scoring, graph-based lexico-semantic text matching",38.0,3.6635616461296463,Q4,"['pattern', 'short answer scoring']",0.5181683110997479
Lark Trills for Language Drills: Text-to-speech technology for language learners,2015.0,"lark trills, news stream, end-to-end tts, learners",5.0,1.791759469228055,Q2,"['news stream', 'learners']",0.3331522226470958
Reducing Annotation Efforts in Supervised Short Answer Scoring,2015.0,"annotation effort, bilingual training",25.0,3.258096538021482,Q4,['annotation effort'],0.28506273076134003
Annotation and Classification of Argumentative Writing Revisions,2015.0,"annotate, classification, argumentative writing revisions",25.0,3.258096538021482,Q4,"['annotate', 'classification']",0.5965522599173589
Embarrassed or Awkward? Ranking Emotion Synonyms for {ESL} Learners{'} Appropriate Wording,2015.0,"emotion words, esl, appropriate wording",1.0,0.6931471805599453,Q1,['esl'],0.130940415099285
Oracle and Human Baselines for Native Language Identification,2015.0,"oracle, human baselines, native-language identification",33.0,3.5263605246161616,Q4,['oracle'],0.34816372731642475
Towards Creating Pedagogic Views from Encyclopedic Resources,2015.0,"hypernym, encyclopedic resources",6.0,1.9459101490553128,Q2,['hypernym'],0.6435982370700493
Judging the Quality of Automatically Generated Gap-fill Question using Active Learning,2015.0,"quality, computer-generated questions, active learner",4.0,1.6094379124341005,Q2,['quality'],0.6098248907621723
Generating Reference Texts for Short Answer Scoring Using Graph-based Summarization,2015.0,"reference texts, short answer scoring, graph-based summarization",8.0,2.19722457733622,Q3,"['reference texts', 'short answer scoring']",0.30586610999311103
Evaluating the performance of Automated Text Scoring systems,2015.0,"privacy guarantees, performance",18.0,2.9444389791664403,Q3,['performance'],0.5860619945779417
Task-Independent Features for Automated Essay Grading,2015.0,"task-independent features, transfer-based",40.0,3.713572066704308,Q4,['transfer-based'],0.15150477426121667
Using Learner Data to Improve Error Correction in Adjective{--}Noun Combinations,2015.0,"learner data, user corrections, adjective-noun pairs",5.0,1.791759469228055,Q2,"['learner data', 'user corrections', 'adjective-noun pairs']",0.1507216086624498
Proceedings of the 2nd Workshop on Argumentation Mining,2015.0,"workshop, argumentation mining",0.0,0.0,Q1,"['workshop', 'argumentation mining']",0.528997397674908
Linking the Thoughts: Analysis of Argumentation Structures in Scientific Publications,2015.0,"thoughts, analysis, argumentation schemes, publications",61.0,4.127134385045092,Q4,"['thoughts', 'analysis', 'argumentation schemes', 'publications']",0.39038776525564967
Identifying Argumentation Schemes in Genetics Research Articles,2015.0,"argumentation schemes, biomedical documents",33.0,3.5263605246161616,Q4,"['argumentation schemes', 'biomedical documents']",0.010076650411949606
Extracting Argument and Domain Words for Identifying Argument Components in Texts,2015.0,"argument, word domain, local similarities, texts",67.0,4.219507705176107,Q4,"['argument', 'word domain', 'texts']",0.39201939618017373
A Shared Task on Argumentation Mining in Newspaper Editorials,2015.0,"shared task, argumentation mining, news editorials",12.0,2.5649493574615367,Q3,"['shared task', 'argumentation mining']",0.6824468562041496
A Computational Approach for Generating Toulmin Model Argumentation,2015.0,"computational approach, generates, toulmin model argumentation",16.0,2.833213344056216,Q3,['computational approach'],0.4485811803618812
Argument Extraction from News,2015.0,"topical contents, news",66.0,4.204692619390966,Q4,['news'],0.7651693085333704
From Argumentation Mining to Stance Classification,2015.0,"argumentation mining, type classification",70.0,4.262679877041316,Q4,"['argumentation mining', 'type classification']",0.5398771901637803
Argument Discovery and Extraction with the Argument Workbench,2015.0,"fact finding, extraction, rst-workbench",7.0,2.079441541679836,Q2,['extraction'],0.5935995748738903
Learning Sentence Ordering for Opinion Generation of Debate,2015.0,"front end, opinion generation, debate",10.0,2.3978952727983707,Q3,"['front end', 'debate']",0.3668627519971591
Towards Detecting Counter-considerations in Text,2015.0,"detecting counter-considerations, text",16.0,2.833213344056216,Q3,['text'],0.5497719290577484
Identifying Prominent Arguments in Online Debates Using Semantic Textual Similarity,2015.0,"prominent arguments, online debate, semantic text similarity",45.0,3.828641396489095,Q4,"['online debate', 'semantic text similarity']",0.30301976011635
And That{'}s A Fact: Distinguishing Factual and Emotional Argumentation in Online Dialogue,2015.0,"factual reasoning, emotional reasoning, online dialogue",44.0,3.80666248977032,Q4,['online dialogue'],0.5375882860123893
Proceedings of the 1st Workshop on Language and Ontologies,2015.0,"workshop, english, ontologies",0.0,0.0,Q1,"['workshop', 'english', 'ontologies']",0.3984389050718697
Ontology Authoring Inspired By Dialogue,2015.0,"ontology, dialogue, authoring",0.0,0.0,Q1,"['ontology', 'dialogue', 'authoring']",0.27420755286659554
Parsing Software Requirements with an Ontology-based Semantic Role Labeler,2015.0,"software resources, rule-based semantic role labeler, parses",13.0,2.6390573296152584,Q3,['parses'],0.20479405359492175
Using Ontologies to Model Polysemy in Lexical Resources,2015.0,"ontologies, polysemy, lexical sources",0.0,0.0,Q1,"['ontologies', 'polysemy']",0.2511775980518994
Modelling time and space in {B}razilian culture,2015.0,"modeled, space, brazil",1.0,0.6931471805599453,Q1,"['space', 'brazil']",0.4864386892014891
When is Lying the Right Choice?,2015.0,lies,0.0,0.0,Q1,['lies'],0.5302099272587373
Towards a Unified Approach to Modality Annotation in {P}ortuguese,2015.0,"unifying theory, tagging modality, portuguese",1.0,0.6931471805599453,Q1,['portuguese'],0.43565894863221855
"Annotating modals with {G}raph{A}nno, a configurable lightweight tool for multi-level annotation",2015.0,"modals, graphanno, flexible tool, multi-level annotation",5.0,1.791759469228055,Q2,"['modals', 'multi-level annotation']",0.07872337372733496
Proceedings of the 11th Joint {ACL}-{ISO} Workshop on Interoperable Semantic Annotation ({ISA}-11),2015.0,"11th joint acl-iso workshop, interoperable semantic annotation, isa-11",0.0,0.0,Q1,['interoperable semantic annotation'],0.8347875438025332
Using a unified taxonomy to annotate discourse markers in speech and writing,2015.0,"unified taxonomy, discourse marking, speech, writing",9.0,2.302585092994046,Q3,"['speech', 'writing']",0.5160912086715534
"Creating and retrieving tense and aspect annotation with {G}raph{A}nno, a lightweight tool for multi-level annotation",2015.0,"tense tagging, graphanno, multi-level annotation, lightweight tool",5.0,1.791759469228055,Q2,['multi-level annotation'],0.1574467474535305
The Semantics of Image Annotation,2015.0,"semantics, image annotation",0.0,0.0,Q1,"['semantics', 'image annotation']",0.173723876044855
Factors Influencing the Implicitation of Discourse Relations across Languages,2015.0,"factors, implicitation, low-resource nmt, languages",13.0,2.6390573296152584,Q3,"['factors', 'implicitation', 'languages']",0.43992179594666414
Instrument subjects without Instrument role,2015.0,"instrument, subject, instrument role",1.0,0.6931471805599453,Q1,"['instrument', 'subject']",0.25806745673148057
The Annotation of Measure Expressions in {ISO} Standards,2015.0,"annotate, measure expressions, iso standard",4.0,1.6094379124341005,Q2,['annotate'],0.513298330866082
Annotating Attribution Relations across Languages and Genres,2015.0,"attributing, languages, genre",3.0,1.3862943611198906,Q2,"['languages', 'genre']",0.6191746081318581
Semantic Relations in Discourse: The Current State of {ISO} 24617-8,2015.0,"semantic relation, discourse, iso 24613",18.0,2.9444389791664403,Q3,"['semantic relation', 'discourse']",0.4272032144519349
Analysis of Temporal Expressions Annotated in Clinical Notes,2015.0,"temporal expression, medical notes",13.0,2.6390573296152584,Q3,['temporal expression'],0.14904029241855754
Rapid {F}rame{N}et annotation of spoken conversation transcripts,2015.0,"framenet, annotate, dialog transcripts",7.0,2.079441541679836,Q2,"['framenet', 'annotate']",0.4443376266748011
Analysis of Word Embeddings and Sequence Features for Clinical Information Extraction,2015.0,"word embeddings, lemma sequences, clinical query patterns",18.0,2.9444389791664403,Q3,['word embeddings'],0.8334083062011186
Using Entity Information from a Knowledge Base to Improve Relation Extraction,2015.0,"entity knowledge, knowledge bank, relation extraction",10.0,2.3978952727983707,Q3,"['entity knowledge', 'knowledge bank', 'relation extraction']",0.4083616606388552
Likelihood Ratio-based Forensic Voice Comparison on {L}2 speakers: A Case of {H}ong {K}ong native male production of {E}nglish vowels,2015.0,"likelihood ratio, forensic voice comparison, l2 speech, hong kong native male production, english vowels",2.0,1.0986122886681098,Q1,"['likelihood ratio', 'forensic voice comparison', 'l2 speech']",0.1387478662837183
Similarity Metrics for Clustering {P}ub{M}ed Abstracts for Evidence Based Medicine,2015.0,"similarity metrics, clustering, medline, evidence-based medicine",2.0,1.0986122886681098,Q1,"['similarity metrics', 'clustering', 'medline', 'evidence-based medicine']",0.1773208482330792
Finding Names in Trove: Named Entity Recognition for {A}ustralian Historical Newspapers,2015.0,"names, trove, named entity learning, australian historical newspapers",18.0,2.9444389791664403,Q3,"['names', 'trove']",0.507113394765728
Clinical Information Extraction Using Word Representations,2015.0,"clinical query patterns, word representation",4.0,1.6094379124341005,Q2,['word representation'],0.8132674503646669
How few is too few? Determining the minimum acceptable number of {LSA} dimensions to visualise text cohesion with Lex,2015.0,"lsa dimensions, text cohesion, lex",1.0,0.6931471805599453,Q1,['lex'],0.3716743692757911
Domain Adaption of Named Entity Recognition to Support Credit Risk Assessment,2015.0,"semantic data, named entity learning, credit risk assessment",13.0,2.6390573296152584,Q3,['semantic data'],0.657663120174935
Do {POS} Tags Help to Learn Better Morphological Segmentations?,2015.0,"pos tag, wind",0.0,0.0,Q1,"['pos tag', 'wind']",0.586260181267788
Improving Topic Coherence with Latent Feature Word Representations in {MAP} Estimation for Topic Modeling,2015.0,"topic stability, risk ranking, map estimation, topic modeling",4.0,1.6094379124341005,Q2,"['map estimation', 'topic modeling']",0.358657131912383
Understanding engagement with insurgents through retweet rhetoric,2015.0,"engagement, insurgents, retweet rhetoric",0.0,0.0,Q1,['engagement'],0.4839338859634801
A comparison and analysis of models for event trigger detection,2015.0,"comparison, analysis, models, generative power",1.0,0.6931471805599453,Q1,"['comparison', 'analysis', 'models', 'generative power']",0.430581844704666
Overview of the 2015 {ALTA} Shared Task: Identifying {F}rench Cognates in {E}nglish Text,2015.0,"alta shared task 2013, french cognates, english text",0.0,0.0,Q1,['english text'],0.24244453204743122
Cognate Identification using Machine Translation,2015.0,"metaphor, machine translate",1.0,0.6931471805599453,Q1,"['metaphor', 'machine translate']",0.6813862784857155
Word Transformation Heuristics Agains Lexicons for Cognate Detection,2015.0,"hosting, heuristic, lexicons, cognate recovery",0.0,0.0,Q1,"['hosting', 'heuristic', 'lexicons']",0.21522614839280615
Proceedings of the 9th International Workshop on Semantic Evaluation ({S}em{E}val 2015),2015.0,"9th international workshop, semantic evaluation, semeval 2015",0.0,0.0,Q1,['semantic evaluation'],0.6313663105247992
{S}em{E}val-2015 Task 1: Paraphrase and Semantic Similarity in {T}witter ({PIT}),2015.0,"semeval-2014 task 1, paraphrase, pingan smart health, twitter, pit",115.0,4.7535901911063645,Q4,"['paraphrase', 'twitter']",0.5756351518334606
{MITRE}: Seven Systems for Semantic Similarity in Tweets,2015.0,"mitre, system, pingan smart health, tweet",25.0,3.258096538021482,Q4,"['mitre', 'system', 'tweet']",0.385235444922138
{CICBUAP}nlp: Graph-Based Approach for Answer Selection in Community Question Answering Task,2015.0,"cicbuapnlp, graph-based strategy, answer choices, community question answering",4.0,1.6094379124341005,Q2,['community question answering'],0.8403698171538687
"{HLTC}-{HKUST}: A Neural Network Paraphrase Classifier using Translation Metrics, Semantic Roles and Lexical Similarity Features",2015.0,"hltc-hkust, neural system, paraphrase classifier, translation metrics, semantic roles, lexical similarity",8.0,2.19722457733622,Q3,"['semantic roles', 'lexical similarity']",0.27937129354114904
{FBK}-{HLT}: An Effective System for Paraphrase Identification and Semantic Similarity in {T}witter,2015.0,"hlt-fbk, system, paraphrasing task, pingan smart health, twitter",3.0,1.3862943611198906,Q2,"['system', 'twitter']",0.47856919666199504
{ECNU}: Leveraging Word Embeddings to Boost Performance for Paraphrase in {T}witter,2015.0,"ecnu, word embeddings, performance, paraphrase, twitter",12.0,2.5649493574615367,Q3,"['ecnu', 'word embeddings', 'performance', 'paraphrase', 'twitter']",0.6431780512392054
{AMRITA}{\_}{CEN}@{S}em{E}val-2015: Paraphrase Detection for {T}witter using Unsupervised Feature Learning with Recursive Autoencoders,2015.0,"amrita_cen@semeval-2015, paraphrase detection, twitter, unsupervised learner, recursive autoencoders",7.0,2.079441541679836,Q2,"['paraphrase detection', 'twitter']",0.6819376317365655
{E}biquity: Paraphrase and Semantic Similarity in {T}witter using Skipgrams,2015.0,"ebiquity, paraphrase, pingan smart health, twitter, skipgrams",10.0,2.3978952727983707,Q3,"['paraphrase', 'twitter', 'skipgrams']",0.4301139241975214
{RTM}-{DCU}: Predicting Semantic Similarity with Referential Translation Machines,2015.0,"rtm-dcu, evaluating semantic similarity, referential translation machines",15.0,2.772588722239781,Q3,['referential translation machines'],0.4287391808930766
{T}witter Paraphrase Identification with Simple Overlap Features and {SVM}s,2015.0,"twitter, paraphrasing task, simple overlap features, svms",40.0,3.713572066704308,Q4,"['twitter', 'svms']",0.4222548998087253
{TKLBLIIR}: Detecting {T}witter Paraphrases with {T}weeting{J}ay,2015.0,"tklbliir, twitter, paraphrase, tweetingjay",4.0,1.6094379124341005,Q2,"['twitter', 'paraphrase']",0.5756351518334606
{CDTDS}: Predicting Paraphrases in {T}witter via Support Vector Regression,2015.0,"cdtds, paraphrase, twitter, support vector learning",6.0,1.9459101490553128,Q2,"['paraphrase', 'twitter']",0.5756351518334606
yi{G}ou: A Semantic Text Similarity Computing System Based on {SVM},2015.0,"yigou, semantic text similarity computing system, svm",4.0,1.6094379124341005,Q2,['svm'],0.2987453161181318
{USAAR}-{SHEFFIELD}: Semantic Textual Similarity with Deep Regression and Machine Translation Evaluation Metrics,2015.0,"usaar-sheffield, semantic text similarity, deep regression, machine translation metrics",10.0,2.3978952727983707,Q3,"['semantic text similarity', 'machine translation metrics']",0.16498199321617968
{T}r{WP}: Text Relatedness using Word and Phrase Relatedness,2015.0,"trwp, text relatedness, word relatedness, word relatedness",5.0,1.791759469228055,Q2,"['text relatedness', 'word relatedness', 'word relatedness']",0.19498690808139518
{M}ini{E}xperts: An {SVM} Approach for Measuring Semantic Textual Similarity,2015.0,"miniexperts, chrf++, semantic text similarity",11.0,2.4849066497880004,Q3,['semantic text similarity'],-8.545609359789097e-05
{FBK}-{HLT}: A New Framework for Semantic Textual Similarity,2015.0,"hlt-fbk, semantic text similarity",6.0,1.9459101490553128,Q2,['semantic text similarity'],-8.545609359789097e-05
{UMD}uluth-{B}lue{T}eam: {SVCSTS} - A Multilingual and Chunk Level Semantic Similarity System,2015.0,"umduluth-blueteam, svcsts, multilingual, chunk level semantic similarity system",9.0,2.302585092994046,Q3,['multilingual'],0.6228774364570816
{S}emanti{KLUE}: Semantic Textual Similarity with Maximum Weight Matching,2015.0,"semantiklue, semantic text similarity, maximum matching",0.0,0.0,Q1,"['semantic text similarity', 'maximum matching']",0.003969272177570482
{ECNU}: Using Traditional Similarity Measurements and Word Embedding for Semantic Textual Similarity Estimation,2015.0,"ecnu, traditional similarity measurements, word embedding, semantic textual similarity estimation",17.0,2.8903717578961645,Q3,"['ecnu', 'word embedding']",0.7408599268602664
{UQ}e{R}esearch: Semantic Textual Similarity Quantification,2015.0,"uqeresearch, semantic text similarity",6.0,1.9459101490553128,Q2,['semantic text similarity'],-8.545609359789097e-05
{WSL}: Sentence Similarity Using Semantic Distance Between Words,2015.0,"wsl, sentence similarity, semantic distance, words",8.0,2.19722457733622,Q3,"['wsl', 'sentence similarity', 'semantic distance', 'words']",0.41744271372422403
{SOPA}: Random Forests Regression for the Semantic Textual Similarity task,2015.0,"sopa, isomorphic, semantic text similarity",3.0,1.3862943611198906,Q2,"['isomorphic', 'semantic text similarity']",0.2254324025369454
{DCU}: Using Distributional Semantics and Domain Adaptation for the Semantic Textual Similarity {S}em{E}val-2015 Task 2,2015.0,"distributional semantics, domain adaptation, semantic text similarity, semeval-2015 task 2, dcu",5.0,1.791759469228055,Q2,"['distributional semantics', 'domain adaptation', 'semantic text similarity', 'dcu']",0.3679197506880154
{DLS}@{CU}: Sentence Similarity from Word Alignment and Semantic Vector Composition,2015.0,"dls@cu, sentence similarity, text alignment, semantic vectors",97.0,4.584967478670572,Q4,"['dls@cu', 'sentence similarity', 'text alignment', 'semantic vectors']",0.3380541749340685
{FCICU}: The Integration between Sense-Based Kernel and Surface-Based Methods to Measure Semantic Textual Similarity,2015.0,"fcicu, sense-based kernel, surface-based methods, semantic text similarity",3.0,1.3862943611198906,Q2,['semantic text similarity'],-8.545609359789097e-05
{AZMAT}: Sentence Similarity Using Associative Matrices,2015.0,"azmat, sentence similarity, matrices",1.0,0.6931471805599453,Q1,"['sentence similarity', 'matrices']",0.5884926769982738
{N}e{R}o{S}im: A System for Measuring and Interpreting Semantic Textual Similarity,2015.0,"nerosim, system, measures, interpreting, semantic text similarity",27.0,3.332204510175204,Q4,"['system', 'measures', 'interpreting', 'semantic text similarity']",0.25782332107675243
{S}amsung: Align-and-Differentiate Approach to Semantic Textual Similarity,2015.0,"samsung, prosody module, semantic text similarity",21.0,3.091042453358316,Q4,['semantic text similarity'],-8.545609359789097e-05
{UBC}: Cubes for {E}nglish Semantic Textual Similarity and Supervised Approaches for Interpretable {STS},2015.0,"ubc, cubes, semantic text similarity, supervised approach, interpretable sts",10.0,2.3978952727983707,Q3,"['ubc', 'semantic text similarity', 'supervised approach']",0.2154530025344902
{ASAP}-{II}: From the Alignment of Phrases to Textual Similarity,2015.0,"asap, aligning sentences, textual similarity",4.0,1.6094379124341005,Q2,['textual similarity'],0.2499783102876767
{TATO}: Leveraging on Multiple Strategies for Semantic Textual Similarity,2015.0,"tato, multiple strategies, semantic text similarity",3.0,1.3862943611198906,Q2,"['tato', 'semantic text similarity']",0.24887453442817836
{HITSZ}-{ICRC}: Exploiting Classification Approach for Answer Selection in Community Question Answering,2015.0,"hitsz-icrc, classification approach, answer choices, community question answering",31.0,3.4657359027997265,Q4,"['hitsz-icrc', 'classification approach', 'community question answering']",0.5357699127240753
{QCRI}: Answer Selection for Community Question Answering - Experiments for {A}rabic and {E}nglish,2015.0,"qcri, answer choices, community question answering, arabic, english",49.0,3.912023005428146,Q4,"['qcri', 'community question answering', 'arabic', 'english']",0.6220444925854058
{ICRC}-{HIT}: A Deep Learning based Comment Sequence Labeling System for Answer Selection Challenge,2015.0,"icrc-hit, news, comment sequence labeling system, ccg",17.0,2.8903717578961645,Q3,"['news', 'ccg']",0.5182274852441142
{JAIST}: Combining multiple features for Answer Selection in Community Question Answering,2015.0,"jaist, multiple features, answer choices, community question answering",57.0,4.060443010546419,Q4,"['jaist', 'multiple features', 'community question answering']",0.4556961675956228
{S}hiraz: A Proposed List Wise Approach to Answer Validation,2015.0,"shiraz, listwise approach, answer validation",2.0,1.0986122886681098,Q1,['answer validation'],0.005169101183798985
Al-Bayan: A Knowledge-based System for {A}rabic Answer Selection,2015.0,"al-bayan, wmd, arabic community",11.0,2.4849066497880004,Q3,"['wmd', 'arabic community']",0.22814493045708428
