Title,Year,Important Words,Citations
"Proceedings of the 29th Pacific Asia Conference on Language, Information and Computation: Posters",2015,"29th pacific asia conference, english, information, computation, posters",0
Identification of Sympathy in Free Conversation,2015,"empathy, free conversation",1
Toward a Corpus of {C}antonese Verbal Comments and their Classification by Multi-dimensional Analysis,2015,"corpus, cantonese verbal comments, classification, multidimensional analysis",1
Improved Entity Linking with User History and News Articles,2015,"entity linkage, user history, news article",1
An Arguing Lexicon for Stance Classification on Short Text Comments in {C}hinese,2015,"arguing lexicon, type classification, short text, chinese",0
Learning Sentential Patterns of Various Rhetoric Moves for Assisted Academic Writing,2015,"sentential patterns, rhetoric moves, academic writing aid",1
{I}dioms: Formally Flexible but Semantically Non-transparent,2015,"idiom, formally flexible, semantically non-transparent",3
Asymmetries in Scrambling and Distinctness of Copies,2015,"asymmetry, autoling, distinctness of copies",0
Detecting an Infant{'}s Developmental Reactions in Reviews on Picture Books,2015,"infants' developmental stages, review, picture book",2
Semi-automatic Filtering of Translation Errors in Triangle Corpus,2015,"german plays, translation error, triangle corpus",1
Cross-language Projection of Dependency Trees for Tree-to-tree Machine Translation,2015,"cross-language projection, dependency tree, tree-to-tree model",4
Realignment from Finer-grained Alignment to Coarser-grained Alignment to Enhance {M}ongolian-{C}hinese {SMT},2015,"realignment, data transfer, data transfer, mongolian",1
Finding the Origin of a Translated Historical Document,2015,"origin, translated historical document",1
Improving the Performance of an Example-Based Machine Translation System Using a Domain-specific Bilingual Lexicon,2015,"performance, example-translation system, domain-specific bilingual lexicon",2
A Multifactorial Analysis of {E}nglish Particle Movement in {K}orean {EFL} Learners{'} Writings,2015,"multifactorial analysis, english particles, korean efl learners",1
An Efficient Annotation for Phrasal Verbs using Dependency Information,2015,"annotate, phrasal verbs, dependency data",3
Color Aesthetics and Social Networks in Complete Tang Poems: Explorations and Discoveries,2015,"color aesthetics, social network, complete tang poems, exploring, discovery",8
{K}orean {T}witter Emotion Classification Using Automatically Built Emotion Lexicons and Fine-Grained Features,2015,"korean twitter, emotion categories, lexicon-based sentiment analysis, fine-grained features",13
{C}hinese Word Segmentation based on analogy and majority voting,2015,"chronus system, analogy, majority vote",2
Enhancing Root Extractors Using Light Stemmers,2015,"rote extractor, light stemmers",9
Where Morphological Complexity Matters,2015,morphological complexity,0
Distinguishing between True and False Stories using various Linguistic Features,2015,"true stories, fake claims, experimenting",0
Bilingually motivated segmentation and generation of word translations using relatively small translation data sets,2015,"bilingually motivated domain, cuni x-ling, small data sets",3
Selecting Contextual Peripheral Information for Answer Presentation: The Need for Pragmatic Models,2015,"context parameters, answer presentation, pragmatic models",1
{R}eal{T}ext-asg: A Model to Present Answers Utilizing the Linguistic Structure of Source Question,2015,"realtext-asg, model, answer, linguistic structure, source context",3
Learning under Covariate Shift for Domain Adaptation for Word Sense Disambiguation,2015,"covariate shift, domain adaptation, word sense disambiguation",4
Unsupervised Domain Adaptation for Word Sense Disambiguation using Stacked Denoising Autoencoder,2015,"knowledge objects, word sense disambiguation, stacked denoising autoencoder",5
Construction of Semantic Collocation Bank Based on Semantic Dependency Parsing,2015,"semantic collocation, phrase dependency parsing",1
Dynamic Semantics for Intensification and Epistemic Necessity: The Case of Y{\'\i}d{\`\i}ng and Sh{\`\i}b{\`\i} in {M}andarin {C}hinese,2015,"dynamic semantics, intensification, epistemicity, y'\id\`\ing, sh\`\ib\`\i, chinese mandarin",1
A Corpus-based Comparatively Study on the Semantic Features and Syntactic patterns of Y{\`o}u/H{\'a}i in {M}andarin {C}hinese,2015,"corpus, semantic feature, syntactic patterns, y\`ou/h\'ai, chinese mandarin",0
An Empirical Study on Sentiment Classification of {C}hinese Review using Word Embedding,2015,"emprical study, extracting data, chinese review, word embedding",26
Polarity Classification of Short Product Reviews via Multiple Cluster-based {SVM} Classifiers,2015,"coreference data, short product reviews, multiple cluster-based svm classifiers",9
Automatic Classification of Spoken Languages using Diverse Acoustic Features,2015,"automatic categorization, spoken language, acoustic features",2
The Syntactic and Semantic Analysis of H{\v{e}}n {X} Constructions in Spoken Corpora,2015,"syntactic analysis, semantic analysis, h\ven x constructions, business",0
Methods and Tool for Constructing Phonetically-Balanced Materials for Speech Perception Testing: A Development of {T}hai Sentence-Length Materials,2015,"method, tool, constructing, phonetically-balanced materials, speech perceiver, develop, thai sentence",2
Graph Theoretic Features of the Adult Mental lexicon Predict Language Production in {M}andarin: Clustering Coefficient,2015,"graph theoretic features, adult mental lexicon, language product, mandarin, clustering coefficient",0
Feature Reduction Using Ensemble Approach,2015,"feature reduction, ensemble strategy",0
"Measuring Popularity of Machine-Generated Sentences Using Term Count, Document Frequency, and Dependency Language Model",2015,"popularity, machine-generated sentences, term count, document frequency, dependency language model",2
Acquiring distributed representations for verb-object pairs by using word2vec,2015,"distributed representation, verb-object pairs, word2vec",1
Dependency parsing for {C}hinese long sentence: A second-stage main structure parsing method,2015,"dependency parses, chinese long sentence, two-stage parser",0
A Light Rule-based Approach to {E}nglish Subject-Verb Agreement Errors on the Third Person Singular Forms,2015,"text-picture relations, coreference density, third person singular forms",3
A Machine Learning Method to Distinguish Machine Translation from Human Translation,2015,"machine-learning, machine translate, human translation",8
"Proceedings of the 29th Pacific Asia Conference on Language, Information and Computation",2015,"29th pacific asia conference, english, information, computation",0
Two-level Word Class Categorization Model in Analytic Languages and Its Implications for {POS} Tagging in {M}odern {C}hinese Corpora,2015,"two-level classifier, analytic languages, implication, pos tagging, chinese corpora",0
A Review of Corpus-based Statistical Models of Language Variation,2015,"corpus-based statistical models, language variation, review",1
Translation of Unseen Bigrams by Analogy Using an {SVM} Classifier,2015,"unseen bigrams, analogy, svm classifier",0
Machine Translation Experiments on {PADIC}: A Parallel {A}rabic {DI}alect Corpus,2015,"machine translate, padic, black & white",62
Surrounding Word Sense Model for {J}apanese All-words Word Sense Disambiguation,2015,"surrounding word sense model, external features",5
Computing Semantic Text Similarity Using Rich Features,2015,"computing, semantic text similarity, rich features",8
{M}echanical {T}urk-based Experiment vs Laboratory-based Experiment: A Case Study on the Comparison of Semantic Transparency Rating Data,2015,"mechanical turk-based experiment, laboratory-based experiment, semantic transparency, casestudy, comparison",13
Discourse Relation Recognition by Comparing Various Units of Sentence Expression with Recursive Neural Network,2015,"discourse predictions, speeches, recursive neural network",1
Bidirectional Long Short-Term Memory Networks for Relation Classification,2015,"bidirectional long short-term memory models, relation classification",157
Distant Supervision for Entity Linking,2015,"distant supervision, entity linkage",10
Toward Algorithmic Discovery of Biographical Information in Local Gazetteers of {A}ncient {C}hina,2015,"syntax based smt, biographical data, soft gazetteers, ancient china",4
Fast and Large-scale Unsupervised Relation Extraction,2015,"fast, large-scale, unsupervised relation extraction",7
Reducing Lexical Features in Parsing by Word Embeddings,2015,"lexical features, parses, word embeddings",3
High-order Graph-based Neural Dependency Parsing,2015,"high-order, graph-based neural dependency parser",4
A Dynamic Syntax Modelling of Postposing in {J}apanese Narratives,2015,"dynamic codes, postposing, japanese narratives",1
Unsupervised and Lightly Supervised Part-of-Speech Tagging Using Recurrent Neural Networks,2015,"unsupervised, lightly superviced, part-of-speech tagging, recurrent networks",15
Identifying Prepositional Phrases in {C}hinese Patent Texts with Rule-based and {CRF} Methods,2015,"iwslt-2009 mt system, chinese patent texts, rule-based method, crf methods",0
{J}apanese Sentiment Classification with Stacked Denoising Auto-Encoder using Distributed Word Representation,2015,"japanese sentiment classification, stacked denoising autoencoder, distributed word models",8
Is {W}ikipedia Really Neutral? A Sentiment Perspective Study of War-related {W}ikipedia Articles since 1945,2015,"wikipedia, sentiment analysis, war-related wikipedia articles, 1945",4
A Comprehensive Filter Feature Selection for Improving Document Classification,2015,"comprehensive filter feature selection, code classification",6
Sentiment Analyzer with Rich Features for Ironic and Sarcastic Tweets,2015,"classification, rich features, ironic tweets, sarcastic memes",6
{T}hai Stock News Sentiment Classification using Wordpair Features,2015,"thai stock news, extracting data, wordpair features",1
Sentiment Classification of {A}rabic Documents: Experiments with multi-type features and ensemble algorithms,2015,"extracting data, arabic documents, multifeature, algorithms",24
The Invertible Construction in {C}hinese,2015,"invertible construction, chinese",0
Pan{'}s (2001) puzzle revisited,2015,pan's (2001) puzzle,1
{E}nglish Right Dislocation,2015,english right dislocation,1
A Comparative Study on {M}andarin and {C}antonese Resultative Verb Compounds,2015,"comparative, mandarin, cantonese, resultative verb compounds",0
Complex-{NP} Islands in {K}orean: An Experimental Approach,2015,"complex-np islands, korean, experimental approach",4
Two Types of Multiple Subject Constructions ({MSC}s) in {K}orean,2015,"multiple subject constructions (mscs), korean",1
A Large-scale Study of Statistical Machine Translation Methods for {K}hmer Language,2015,"large-scale study, machine-translation approach, khmer-english",7
{E}nglish to {C}hinese Translation: How {C}hinese Character Matters,2015,"english, chinese to english, chinese character",3
Well-Formed Dependency to String translation with {BTG} Grammar,2015,"well-formed dependency, string translation, btg grammar",0
Large-scale Dictionary Construction via Pivot-based Statistical Machine Translation with Significance Pruning and Neural Network Features,2015,"large-scale dictionary, phrase pivot, significance pruning, neural image",5
Annotation and Classification of {F}rench Feedback Communicative Functions,2015,"annotate, classification, french feedback, communicative functions",7
Automatic conversion of sentence-end expressions for utterance characterization of dialogue systems,2015,"automatic converter, sentence-end expressions, utterance classification, punjabi alphabet",12
Auditory Synaesthesia and Near Synonyms: A Corpus-Based Analysis of sheng1 and yin1 in {M}andarin {C}hinese,2015,"synesthesia, near-synonym, corpus mining, sheng1, yin1, chinese mandarin",4
System Utterance Generation by Label Propagation over Association Graph of Words and Utterance Patterns for Open-Domain Dialogue Systems,2015,"german email corpus, label propagation, relation graph, words, utterance patterns, football world cup",9
The Cross-modal Representation of Metaphors,2015,"cross-modal representation, metaphors",0
Writing to Read: the Case of {C}hinese,2015,"writing, read, chinese",6
Design of a Learner Corpus for Listening and Speaking Performance,2015,"learner corpus, linguistic behavior, linguistic behavior",0
Understanding Infants{'} Language Development in Relation to Levels of Consciousness: An Approach in Building up an Agent-based Model,2015,"infants' language development, levels of consciousness, agent-based model",0
Pivot-Based Topic Models for Low-Resource Lexicon Extraction,2015,"pivot-based modeling, tregex",1
A Corpus-Based Study of zunshou and Its {E}nglish Equivalents,2015,"corpus-based bias, zunshou, english phrases",0
Self Syntactico-Semantic Enrichment of {LMF} Normalized Dictionaries,2015,"lexico-semantic annotation, lmf-normalized dictionaries",0
When Embodiment Meets {G}enerative {L}exicon: The Human Body Part Metaphors in Sinica Corpus,2015,"embodiment, generative lexicon, human body part metaphors, sinica corpus",4
Degree Variables by Choose Degree in Izyooni {`}than{'}-Clauses,2015,"degree variables, izyooni `than'-clauses",0
Not Voice but Case Identity in {VP} Ellipsis of {E}nglish,2015,"voice, case identity, vp ellipsis, english",0
A Statistical Modeling of the Correlation between Island Effects and Working-memory Capacity for {L}2 Learners,2015,"statistical modeling, correlates, wh-islands, working-memory capacity, l3 learning",0
De-verbalization and Nominal Categories in {M}andarin {C}hinese: A corpus-driven study in both Mainland {M}andarin and {T}aiwan {M}andarin,2015,"verbalism, nominal categories, chinese mandarin, corpus-based bias, baseline results, taiwan mandarin",0
Zero Object Resolution in {K}orean,2015,"zero object, resolution, korean",4
An Improved Hierarchical Word Sequence Language Model Using Directional Information,2015,"pit corpus, directional information",3
Neural Network Language Model for {C}hinese {P}inyin Input Method Engine,2015,"neural system, language model, pinyin, input method",16
Real-time Detection and Sorting of News on Microblogging Platforms,2015,"real-time detection, sort, news, signbank",3
Trouble information extraction based on a bootstrap approach from {T}witter,2015,"trouble information extraction, bootstrap approach, twitter",1
Using {T}witter Data to Infer Personal Values of {J}apanese Consumers,2015,"twitter data, personal values, japanese consumers",0
Distant-supervised Language Model for Detecting Emotional Upsurge on {T}witter,2015,"unsupervised language model, path of motion, twitter",0
Hybrid Method of Semi-supervised Learning and Feature Weighted Learning for Domain Adaptation of Document Classification,2015,"hybrid method, supervised data, feature-weight learning, domain adaptation, code classification",4
Paraphrase Detection Based on Identical Phrase and Similar Word Matching,2015,"paraphrase detection, identical phrase, similar words",6
Multi-aspects Rating Prediction Using Aspect Words and Sentences,2015,"west african languages, aspect words, sentences",0
Understanding Rating Behaviour and Predicting Ratings by Identifying Representative Users,2015,"rating behaviour, predicting ratings, user relations",3
Cross-lingual Pseudo Relevance Feedback Based on Weak Relevant Topic Alignment,2015,"cross-lingual pseudo relevance, feedback, weak relevant topic alignment",0
Corpus annotation with a linguistic analysis of the associations between event mentions and spatial expressions,2015,"corpus annotation, linguistic analyses, associations, relu, spatial expressions",0
Recognizing Complex Negation on {T}witter,2015,"logical negation, twitter",3
Topic Model for Identifying Suicidal Ideation in {C}hinese Microblog,2015,"topic model, suicidality, weibo messages",28
Predicting Sector Index Movement with Microblogging Public Mood Time Series on Social Issues,2015,"acknowledgment use, microblog, public mood time series, challenges",2
Proceedings of the 12th International Conference on Natural Language Processing,2015,"12th international conference, natural language processing",0
Keynote Lecture 1: Scientific Paper Analysis,2015,"information gain ratio, keynote",0
Addressing Class Imbalance in Grammatical Error Detection with Evaluation Metric Optimization,2015,"class imbalance, grammar error detection, evaluation metric optimization",0
Words are not Equal: Graded Weighting Model for Building Composite Document Vectors,2015,"words, weighting model, composite document vectors",9
Online Adspace Posts{'} Category Classification,2015,"online adspace, posts' category, classification",0
Noun Phrase Chunking for {M}arathi using Distant Supervision,2015,"noun-phrase chunking, marathi, distant supervision",1
Self-Organizing Maps for Classification of a Multi-Labeled Corpus,2015,"self-organizing map, classification, labelled corpus",0
Word Sense Disambiguation in {H}indi Language Using Hyperspace Analogue to Language and Fuzzy {C}-Means Clustering,2015,"word sense disambiguation, hindi, hyperspace analogue to language, fuzzy sets",7
Using Word Embeddings for Bilingual Unsupervised {WSD},2015,"word embeddings, bilingual, multi-relational",2
Compositionality in {B}angla Compound Verbs and their Processing in the Mental Lexicon,2015,"compositionality, bangla compound verbs, process, live lexicons",0
{I}ndo{W}ord{N}et Dictionary: An Online Multilingual Dictionary using {I}ndo{W}ord{N}et,2015,"indowordnet, stock markets, indowordnet",1
Let Sense Bags Do Talking: Cross Lingual Word Semantic Similarity for {E}nglish and {H}indi,2015,"sense bags, distress, english, hindi",0
A temporal expression recognition system for medical documents by,2015,"inference rule verification, medical documents",2
An unsupervised {EM} method to infer time variation in sense probabilities,2015,"unsupervised method, time variation, sense probabilities",1
Solving Data Sparsity by Morphology Injection in Factored {SMT},2015,"legal rules, morphology injection, factored smt",5
Authorship Attribution in {B}engali Language,2015,"authorship, bangla language",16
{T}rans{C}hat: Cross-Lingual Instant Messaging for {I}ndian Languages,2015,"transchat, semantic concordance, indian english",1
A Database of Infant Cry Sounds to Study the Likely Cause of Cry,2015,"dataset, infant cry sounds, likely cause of cry",14
Perplexed {B}ayes Classifier,2015,naive bayes-svm,0
An Empirical Study of Diversity of Word Alignment and its Symmetrization Techniques for System Combination,2015,"emprical study, diversity, text alignment, symmetrization techniques, combined systems",0
Domain Sentiment Matters: A Two Stage Sentiment Analyzer,2015,"news sentiment, two stage sentiment analysis",6
Extracting Information from {I}ndian First Names,2015,"information, indian first names",0
punct-An Alternative Verb Semantic Ontology Representation,2015,"punct, alternative verb, semantic ontology",0
{SMT} Errors Requiring Grammatical Knowledge for Prevention,2015,"smt errors, grammatical knowledge, prevention",1
Isolated Word Recognition System for {M}alayalam using Machine Learning,2015,"text recognition, malayalam, machine-learning",1
Judge a Book by its Cover: Conservative Focused Crawling under Resource Constraints,2015,"conservative focused crawling, resource demand",0
Text Normalization and Unit Selection for a Memory Based Non Uniform Unit Selection {TTS} in {M}alayalam,2015,"text smoothing, unit selection, memory based non uniform unit selection tts, malayalam",0
Morphological Analyzer for {G}ujarati using Paradigm based approach with Knowledge based and Statistical Methods,2015,"turkish morphology, gujarati, paradigmatic approach, knowledge-based method, statistical methods",0
Resolution of Pronominal Anaphora for {T}elugu Dialogues,2015,"rocling xvi, telugu dialogues",2
A Study on Divergence in {M}alayalam and {T}amil Language in Machine Translation Perceptive,2015,"divergent, malayalam, tamil language, machine translate",0
Automatic conversion of {I}ndian Language Morphological Processors into Grammatical Framework ({GF}),2015,"hindi morphological analyzer, open domain conversation",0
Logistic Regression for Automatic Lexical Level Morphological Paradigm Selection for {K}onkani Nouns,2015,"logistic regression, automatic lexical level, morphological paradigm, konkani",0
{R}uchi: Rating Individual Food Items in Restaurant Reviews,2015,"ruchi, food items, restaurant reviews",7
Dependency Extraction for Knowledge-based Domain Classification,2015,"dependency extraction, knowledge-based domain classification",0
An Approach to Collective Entity Linking,2015,"approach, global entity linking",0
Development of Speech corpora for different Speech Recognition tasks in {M}alayalam language,2015,"speech corpora, speech recognition tasks, malayalam",2
{POS} Tagging of {H}indi-{E}nglish Code Mixed Text from Social Media: Some Machine Learning Experiments,2015,"pos tagging, english-hindi code-mixed text, social media, machine-learning",20
Automated Analysis of {B}angla Poetry for Classification and Poet Identification,2015,"automated analysis, bangla poetry, classification, poet identification",17
Sentence Boundary Detection for Social Media Text,2015,"proscript, social media text",12
Mood Classification of {H}indi Songs based on Lyrics,2015,"mood classification, hindi songs, lyrics",15
"Using Skipgrams, Bigrams, and Part of Speech Features for Sentiment Classification of {T}witter Messages",2015,"skipgrams, bigrams, part of speech features, extracting data, twitter messages",5
A Hybrid Approach for Bracketing Noun Sequence,2015,"hybrid approach, brackets, noun sequence",0
Simultaneous Feature Selection and Parameter Optimization Using Multi-objective Optimization for Sentiment Analysis,2015,"feature selection, parameter optimization, multiobjective optimization, sentiment analysis",0
Detection of Multiword Expressions for {H}indi Language using Word Embeddings and {W}ord{N}et-based Features,2015,"multiword expressions, hindi, word embeddings, wordnet features",8
Augmenting Pivot based {SMT} with word segmentation,2015,"pivot-based smt, word segmentation",3
Using Multilingual Topic Models for Improved Alignment in {E}nglish-{H}indi {MT},2015,"multilingual topic model, align, english-hindi mt",3
Triangulation of Reordering Tables: An Advancement Over Phrase Table Triangulation in Pivot-Based {SMT},2015,"triangulation of reordering tables, avances, phrase table triangulation, pivot-based smt",1
Post-editing a chapter of a specialized textbook into 7 languages: importance of terminological proximity with {E}nglish for productivity,2015,"postediting, specialised texts, 7 languages, diachronic proximity, english, productivity",2
Generating Translation Corpora in Indic Languages:Cultivating Bilingual Texts for Cross Lingual Fertilization,2015,"variant corpora, indic language, bilingual texts, cross lingual",2
Translation Quality and Effort: Options versus Post-editing,2015,"translation quality, effort, choice, postediting",1
Investigating the potential of post-ordering {SMT} output to improve translation quality,2015,"post-ordering smt output, translation quality",0
Applying {S}anskrit Concepts for Reordering in {MT},2015,"sanskrit concepts, reordering, p/2",2
Dialogue Act Recognition for Text-based {S}inhala,2015,"dialogue act detection, text-based, sinhala",2
A Semi Supervised Dialog Act Tagging for {T}elugu,2015,"semi supervised dialog act tagging, telugu",3
Ranking Model with a Reduced Feature Set for an Automated Question Generation System,2015,"rank models, reduced feature set, automated question generation",3
Natural Language Processing for Solving Simple Word Problems,2015,"natural language processing, simple word problems",7
Analysis of Influence of {L}2 {E}nglish Speakers{'} Fluency on Occurrence and Duration of Sentence-medial Pauses in {E}nglish Readout Speech,2015,"l2, fluent, occurrence, duration, sentence-medial pauses, english readout speech",0
Acoustic Correlates of Voicing and Gemination in {B}angla,2015,"acoustic correlates, voicing, gemination, bangla",0
Proceedings of the 18th Annual Conference of the {E}uropean Association for Machine Translation,2015,"18th annual conference, european association for machine translation",0
Exploiting portability to build an {RBMT} prototype for a new source language,2015,"portability, rmt, source language",4
Building hybrid machine translation systems by using an {EBMT} preprocessor to create partial translations,2015,"hybrid machine translation system, ebmt preprocessor, partial translations",0
Using on-line available sources of bilingual information for word-level machine translation quality estimation,2015,"multiple on-line sources, bilingual information, word-level machine translation, quality estimates",8
A general framework for minimizing translation effort: towards a principled combination of translation technologies in computer-aided translation,2015,"legal framework, minimizing translation effort, principled combination, translation technologies, computer-aided translation",6
Can Translation Memories afford not to use paraphrasing?,2015,"translation memories, paraphrasing",16
Dependency-based Reordering Model for Constituent Pairs in Hierarchical {SMT},2015,"dependency-based hybrid model, constituent pairs, hierarchical smt",6
The role of artificially generated negative data for quality estimation of machine translation,2015,"negative focus, quality estimates, machine translate",6
Document-Level Machine Translation with Word Vector Models,2015,"document-level adaptation, word vector sets",12
The potential and limits of lay post-editing in an online community,2015,"lay post-editing, web community",3
