Title,Year,Important Words,Citations
Modelling the Adjunct/Argument Distinction in Hierarchical Phrase-Based {SMT},2015,"modeled, adjunct distinction, hierarchical phrase-based smt",0
Towards Deeper {MT} - A Hybrid System for {G}erman,2015,"deeper mt, hybrid system, german",0
Splitting Compounds by Semantic Analogy,2015,"splitting compounds, semantic analogy",18
Delimiting Morphosyntactic Search Space with Source-Side Reordering Models,2015,"graph representations, source-side preordering",0
Evaluating a Machine Translation System in a Technical Support Scenario,2015,"machine translation system, technical support scenario",1
Development of {T}elugu-{T}amil Transfer-Based Machine Translation system: With Special reference to Divergence Index,2015,"mod\`ele, divergence index",1
Deep-syntax {T}ecto{MT} for {E}nglish-{S}panish {MT},2015,"deep-syntax tectomt, english, spanish, mt",0
First Steps in Using Word Senses as Contextual Features in Maxent Models for Machine Translation,2015,"word sense, contextual features, maxent, machine translate",5
Lexical choice in Abstract Dependency Trees,2015,"lexical choice, pedagogical text",0
Large Scale Translation Quality Estimation,2015,"large scale translation, quality estimates",5
Translation Model Interpolation for Domain Adaptation in {T}ecto{MT},2015,"translation modes, interpolated, domain adaptation, tectomt",10
Factored models for Deep Machine Translation,2015,"factored model, deep machine translation",5
Machine Translation for Multilingual Troubleshooting in the {IT} Domain: A Comparison of Different Strategies,2015,"machine translate, speech clues, it domain, comparison, strategies",2
Proceedings of the Second Workshop on Natural Language Processing and Linked Open Data,2015,"second workshop, natural language processing, linked open data",0
Cross-lingual Event Detection in Discourse,2015,"cross-lingual event, detecting, discourse",1
Generating Lexicalization Patterns for Linked Open Data,2015,"lexicalization, linked open data",8
"Small in Size, Big in Precision: A Case for Using Language-Specific Lexical Resources for Word Sense Disambiguation",2015,"size, accuracy, specialized lexical resources, word sense disambiguation",0
Towards the Representation of Hashtags in Linguistic Linked Open Data Format,2015,"represent, hashtags, xml text representation",1
An Ontology-based Approach To Automatic Part-of-Speech Tagging Using Heterogeneously Annotated Corpora,2015,"ontology-based method, faster part-of-speech tagging, heterogeneous annotated corpora",3
Accessing Linked Open Data via A Common Ontology,2015,"linked open data, infodemic",4
The {G}uan{X}i network: a new multilingual {LLOD} for Language Learning applications,2015,"guanxi network, multilingual, language apps",5
"Proceedings of the Joint Workshop on Language Technology for Closely Related Languages, Varieties and Dialects",2015,"joint workshop on language technology, closely-related languages, variety, dialect",0
Overview of the {DSL} Shared Task 2015,2015,dsl shared task 2016,97
Handling and Mining Linguistic Variation in {UGC},2015,"handling, mining, origins of language, ugc (user-generated content)",0
Distributed Representations of Words and Documents for Discriminating Similar Languages,2015,"distributed representation, words, document, lemmatag",20
Joint {B}ayesian Morphology Learning for {D}ravidian Languages,2015,"joint bayesian morphology learning, dravidian language",2
"Use of Transformation-Based Learning in Annotation Pipeline of {I}gbo, an {A}frican Language",2015,"english conversations, annotation pipeline, igbo, african language",7
{W}iki{T}rans: {S}wedish-{D}anish Machine Translation in a Constraint Grammar Framework,2015,"wikitrans, danish-english machine translation, constraint grammar",0
Language Identification using Classifier Ensembles,2015,"language identifier, classifier ensembles",63
Discriminating Similar Languages with Token-Based Backoff,2015,"lemmatag, token-based backoff",19
{NLEL} {UPV} Autoritas Participation at Discrimination between Similar Languages ({DSL}) 2015 Shared Task,2015,"nlel upv autoritas, discriminating similar languages, 2015 shared task",10
Discriminating between Similar Languages Using {PPM},2015,"lemmatag, ppm",12
Comparing Approaches to the Identification of Similar Languages,2015,"approach, identity, lemmatag",18
A Two-level Classifier for Discriminating Similar Languages,2015,"two-level classifier, lemmatag",14
Experiments in Discriminating Similar Languages,2015,"experiments, discriminating, lemmatag",21
Building Monolingual Word Alignment Corpus for the Greater {C}hina Region,2015,"rescoring, greater china region",2
The 5th Workshop on {B}alto-{S}lavic Natural Language Processing,2015,"5th workshop, balto-slavic, natural language processing",0
"{U}niversal {D}ependencies for {C}roatian (that work for {S}erbian, too)",2015,"global dependencies, croatia, serbe",21
Analytic Morphology {--} Merging the Paradigmatic and Syntagmatic Perspective in a Treebank,2015,"analytic morphology, paradigmatic approach, syntagmatic approaches, treebank",3
Resolving Entity Coreference in {C}roatian with a Constrained Mention-Pair Model,2015,"entity coreference, croatia, constrained mention-pair model",0
Evaluation of Coreference Resolution Tools for {P}olish from the Information Extraction Perspective,2015,"coreference resolution tools, polish, zodiac",3
Open Relation Extraction for {P}olish: Preliminary Experiments,2015,"open relation extraction, polish, empirical facts",0
Regional Linguistic Data Initiative ({R}e{LDI}),2015,regional linguistic data initiative (reldi),6
Online Extraction of {R}ussian Multiword Expressions,2015,"online extraction, russian expressions",6
{E}-law Module Supporting Lawyers in the Process of Knowledge Discovery from Legal Documents,2015,"e-law module, lawyers, concept discovery, legal documents",0
Experiments on Active Learning for {C}roatian Word Sense Disambiguation,2015,"experiments, active learner, croatian word sense disambiguation",3
Automatic Classification of {W}ord{N}et Morphosemantic Relations,2015,"automatic categorization, wordnet, morphosemantic frames",4
Applying Multi-Dimensional Analysis to a {R}ussian Webcorpus: Searching for Evidence of Genres,2015,"multidimensional analysis, russian webcorpus, genre",7
"Distinctive Similarity of Clausal Coordinate Ellipsis in {R}ussian Compared to {D}utch, {E}stonian, {G}erman, and {H}ungarian",2015,"review, russian, dutch, estonian, german, hungary",0
Universalizing {B}ul{T}ree{B}ank: a Linguistic Tale about Glocalization,2015,"universalizing bultreebank, linguistic tale, glocalization",5
Types of Aspect Terms in Aspect-Oriented Sentiment Labeling,2015,"aspect terms, written reports",1
Authorship Attribution and Author Profiling of {L}ithuanian Literary Texts,2015,"authorship, author profiling, lithuanian corpus",7
Classification of Short Legal {L}ithuanian Texts,2015,"short legal lithuanian texts, classification",5
Proceedings of the Workshop Natural Language Processing for Translation Memories,2015,"workshop, natural language processing, translation memories",0
Creation of new {TM} segments: Fulfilling translators{'} wishes,2015,"tm segments, semdeep-5",2
Spotting false translation segments in translation memories,2015,"false translation segments, translation memories",12
Improving Translation Memory Matching through Clause Splitting,2015,"translation memory matching, word splitting",5
Improving translation memory fuzzy matching by paraphrasing,2015,"volume 31, inforex, paraphrasing",7
Increasing Coverage of Translation Memories with Linguistically Motivated Segment Combination Methods,2015,"coverage of translation memories, linguistically motivated segment combination methods",2
{CAT}a{L}og: New Approaches to {TM} and Post Editing Interfaces,2015,"tm (translation memory), post-editing interface",12
Proceedings of {SLPAT} 2015: 6th Workshop on Speech and Language Processing for Assistive Technologies,2015,"slpat 2015, 6th workshop, spoken language processing, assistive technology",0
"Talking Heads, Signing Avatars and Social Robots",2015,"talking heads, row, social robot",0
Bridging the gap between sign language machine translation and sign language animation using sequence classification,2015,"automatic categorization, sign language, sequence classifiers",15
Synthesizing the finger alphabet of {S}wiss {G}erman Sign Language and evaluating the comprehensibility of the resulting animations,2015,"finger alphabet, german sign language, comprehensibility, animation, synthesised",7
Contour-based Hand Pose Recognition for Sign Language Recognition,2015,"contour-based hand pose recognition, sign language recognition",4
Synthesizing and Evaluating Animations of {A}merican {S}ign {L}anguage Verbs Modeled from Motion-Capture Data,2015,"synthesised, evaluating, animation, american sign language verbs, modeled, motion-capture data",3
Evaluating a Dynamic Time Warping Based Scoring Algorithm for Facial Expressions in {ASL} Animations,2015,"dynamic time warping, scoring algorithm, facial displays, asl animations",6
Qualitative investigation of the display of speech recognition results for communication with deaf people,2015,"qualitative experiments, display of speech recognition results, communication, deaf people",7
Predicting disordered speech comprehensibility from Goodness of Pronunciation scores,2015,"disordered speech, goodness of pronunciation scores",4
Recognizing Dysarthric Speech due to Amyotrophic Lateral Sclerosis with Across-Speaker Articulatory Normalization,2015,"dysarthric speech, amyotrophic lateral sclerosis, articulatory speaker normalisation",12
Vowel Enhancement in Early Stage {S}panish Esophageal Speech Using Natural Glottal Flow Pulse and Vocal Tract Frequency Warping,2015,"vowel reduction, early stage spanish esophageal speech, natural glottal flow pulse, vocal tract frequency warping",0
Automatic dysfluency detection in dysarthric speech using deep belief networks,2015,"fluency filtering, dysarthric speech, automatic, deep belief network",9
Model adaptation and adaptive training for the recognition of dysarthric speech,2015,"map adaptation, adaptive testing, recognition, dysarthric speech",13
Pronunciation Adaptation For Disordered Speech Recognition Using State-Specific Vectors of Phone-Cluster Adaptive Training,2015,"pronunciation adaptation, disordered speech, state-specific vectors, phone-cluster adaptive training",4
"Determining an Optimal Set of Flesh Points on Tongue, Lips, and Jaw for Continuous Silent Speech Recognition",2015,"optimal set, flesh points, tongue, lips, jaw, continuous speech",11
Analysis of Dysarthric Speech using Distinctive Feature Recognition,2015,"dysarthric speech, distinctive, analysis",5
Generating acceptable {A}rabic Core Vocabularies and Symbols for {AAC} users,2015,"arabic core vocabularies, symbol, aac users",0
Remote Speech Technology for Speech Professionals - the {C}loud{CAST} initiative,2015,"remote speech technology, speech professionals, the cloudcast initiative",4
Speech and language technologies for the automatic monitoring and training of cognitive functions,2015,"speech and language therapy, automatic reading, training, cognitive functions",3
Extending a {D}utch Text-to-Pictograph Converter to {E}nglish and {S}panish,2015,"dutch data-to-text system, english, spanish",4
Individuality-Preserving Spectrum Modification for Articulation Disorders Using Phone Selective Synthesis,2015,"individuality-preserving spectrum modification, articulation disorders, phone selective synthesis",1
Recognition of Distress Calls in Distant Speech Setting: a Preliminary Experiment in a Smart Home,2015,"collocations, distant speech setting, preliminary test, smart home",5
A Comparison of Manual and Automatic Voice Repair for Individual with Vocal Disabilities,2015,"manual voice repair, automatic voice repair, spoken dialogue tutoring system",1
Using linguistic features longitudinally to predict clinical scores for {A}lzheimer{'}s disease and related dementias,2015,"experimenting, longitudinally, predict clinical scores, alzheimer's disease, related dementias",42
From {E}uropean {P}ortuguese to {P}ortuguese {S}ign {L}anguage,2015,"answer recall, portuguese sign language",4
Proceedings of the 2nd Workshop on {A}sian Translation ({WAT}2015),2015,2nd workshop on asian translation (wat2015),0
Overview of the 2nd Workshop on {A}sian Translation,2015,transcript-based query,37
System Combination of {RBMT} plus {SPE} and Preordering plus {SMT},2015,"combined systems, rbmt (rule-based machine translation), spe (statistical post-editing), preordering, smt (statistical machine translation)",4
Neural Reranking Improves Subjective Quality of Machine Translation: {NAIST} at {WAT}2015,2015,"neural reranking, ambient, machine translate, naist, 2015",59
{NICT} at {WAT} 2015,2015,"nict, 2015",2
Toshiba {MT} System Description for the {WAT}2015 Workshop,2015,"toshiba mt system, 2016 workshop",2
{K}yoto{EBMT} System Description for the 2nd Workshop on {A}sian Translation,2015,"kyotoebmt, transcript-based query",6
Evaluating Neural Machine Translation in {E}nglish-{J}apanese Task,2015,"neural translator, english-japanese task",10
{NAVER} Machine Translation System for {WAT} 2015,2015,"naver, machine translation system, 2015",16
An Awkward Disparity between {BLEU} / {RIBES} Scores and Human Judgements in Machine Translation,2015,"bleu scores, ribes scores, human judgments, machine translate",12
A Dependency-to-String Model for {C}hinese-{J}apanese {SMT} System,2015,"dependency-to-string model, chinese-to-japanese smt",1
Sampling-based Alignment and Hierarchical Sub-sentential Alignment in {C}hinese{--}{J}apanese Translation of Patents,2015,"gestuels, industrial initiative, voice dialog systems, patents",1
{C}hinese-to-{J}apanese Patent Machine Translation based on Syntactic Pre-ordering for{WAT} 2015,2015,"patent machine translation, syntactic pre-ordering, forwat 2015",3
Source Phrase Segmentation and Translation for {J}apanese-{E}nglish Translation Using Dependency Structure,2015,"source representations, translate, japanese-english translation, dependency structure",1
Proceedings of the 15th {E}uropean Workshop on Natural Language Generation ({ENLG}),2015,15th european workshop on natural language generation (enlg),0
A Simple Surface Realization Engine for {T}elugu,2015,"surface realization, telugu",6
Input Seed Features for Guiding the Generation Process: A Statistical Approach for {S}panish,2015,"input seed features, lcm-pl, statistical approach, spanish",4
A Domain Agnostic Approach to Verbalizing n-ary Events without Parallel Corpora,2015,"domain agnostic approach, verbalize, n-ary events, parallel corpora",0
Inducing Clause-Combining Rules: A Case Study with the {SP}a{RK}y Restaurant Corpus,2015,"clause-combining rules, sparky restaurant corpus",4
Reading Times Predict the Quality of Generated Text Above and Beyond Human Ratings,2015,"reading time, food type extraction, human ratings",3
Moving Targets: Human References to Unstable Landmarks,2015,"human labels, unstable landmarks",0
A Framework for the Generation of Computer System Diagnostics in Natural Language using Finite State Methods,2015,"framework, genesis, computer system diagnostics, raw speech, finite state methods",4
A Snapshot of {NLG} Evaluation Practices 2005 - 2014,2015,"nlg (natural language generation), evaluation trends, 2005, 2014",28
{J}apanese Word Reordering Executed Concurrently with Dependency Parsing and Its Evaluation,2015,"japanese word, reordering, dependency parses, evaluate",0
Sentence Ordering in Electronic Navigational Chart Companion Text Generation,2015,"front end, electronic navigational chart, textgeneration",2
Natural Language Generation from Pictographs,2015,"natural text generation, pictograms",8
Translating {I}talian to {LIS} in the Rail Stations,2015,"italian, italian sign language, rail stations",1
Response Generation in Dialogue Using a Tailored {PCFG} Parser,2015,"response generation, dialogue, pcfg parsing",3
Generating R{\'e}cit from Sensor Data: Evaluation of a Task Model for Story Planning and Preliminary Experiments with {GPS} Data,2015,"r'ecit, sensor data, task model, story plans, empirical facts, gps data",3
Generating and Evaluating Landmark-Based Navigation Instructions in Virtual Environments,2015,"landmark navigation instructions, virtual environment, generates, evaluating",5
Summarising Unreliable Data,2015,unreliable data,0
Generating Descriptions of Spatial Relations between Objects in Images,2015,"descriptions, spatial relations, objects, photo",5
"Towards Flexible, Small-Domain Surface Generation: Combining Data-Driven and Grammatical Approaches",2015,"flexible, small-domain surface generation, data-driven approaches, grammatical approaches",0
{JS}real{B}: A Bilingual Text Realizer for Web Programming,2015,"jsrealb, bilingual text, web programming",12
A Game-Based Setup for Data Collection and Task-Based Evaluation of Uncertain Information Presentation,2015,"game-based setup, data capture, task-based evaluation, uncertain data",4
Generating Referential Descriptions Involving Relations by a Best-First Searching Procedure {--} A System Demo,2015,"referential descriptions, relation, language identifier, system demo",0
"Generating Image Descriptions with Gold Standard Visual Inputs: Motivation, Evaluation and Baselines",2015,"image senses, gold standard visual inputs, motivates, evaluate, baselines",11
Designing an Algorithm for Generating Named Spatial References,2015,"algorithm, spatial reference",9
Narrative Generation from Extracted Associations,2015,"narrative generation, extracted associations",4
Topic Transition Strategies for an Information-Giving Agent,2015,"topic transition, information-giving agent",5
Creating Textual Driver Feedback from Telemetric Data,2015,"textual driver feedback, telemetric data",8
A Personal Storytelling about Your Favorite Data,2015,"word classes, data",4
Proceedings of the First Workshop on Computing News Storylines,2015,first workshop on computing news storylines,0
Interactions between Narrative Schemas and Document Categories,2015,"interactions, narrative schema, document categories",5
Improving Event Detection with {A}bstract {M}eaning {R}epresentation,2015,"event detection, abstract words",30
News clustering approach based on discourse text structure,2015,"news clustering approach, discourse structure",4
To Do or Not to Do: the Role of Agendas for Action in Analyzing News Coverage of Violent Conflict,2015,"agendas for action, the news, armed conflicts",3
{M}edia{M}eter: A Global Monitor for Online News Coverage,2015,"mediameter, global monitor, web news",1
Expanding the horizons: adding a new language to the news personalization system,2015,"news personalization system, english",1
Storylines for structuring massive streams of news,2015,"storylines, structures, massive streams, news",34
From {T}ime{L}ines to {S}tory{L}ines: A preliminary proposal for evaluating narratives,2015,"timelines, storylines, preliminary model, ",8
Cross-Document Non-Fiction Narrative Alignment,2015,"cross-document, non-fiction, narrative alignment",3
Proceedings of the 2nd Workshop on Natural Language Processing Techniques for Educational Applications,2015,"workshop, natural language processing methods, pedagogic usefulness",0
Overview of the {NLP}-{TEA} 2015 Shared Task for {C}hinese Grammatical Error Diagnosis,2015,"nlp-tea 2016 shared task, polyglot semantic parsing",2
{C}hinese Grammatical Error Diagnosis by Conditional Random Fields,2015,"chinese, grammar error detection, condition random fields",10
{NTOU} {C}hinese Grammar Checker for {CGED} Shared Task,2015,"ntou, chinese spell checker, cged shared task",7
Collocation Assistant for Learners of {J}apanese as a Second Language,2015,"collocation, learners, japanese, second language",0
Semi-automatic Generation of Multiple-Choice Tests from Mentions of Semantic Relations,2015,"automated generation, multiple answers, mention, semantic relation",3
Interactive Second Language Learning from News Websites,2015,"iterated language learning, news media",4
Bilingual Keyword Extraction and its Educational Application,2015,"semiautomatic annotation, pedagogic usefulness",2
Annotating Entailment Relations for Shortanswer Questions,2015,"entailment relations, short answers",2
An Automated Scoring Tool for {K}orean Supply-type Items Based on Semi-Supervised Learning,2015,"scoring tool, korean supply-type items, supervised data",0
A System for Generating Multiple Choice Questions: With a Novel Approach for Sentence Selection,2015,"system, multiple-choice question generation, novel approach, sentence selection",16
The {``}News Web Easy{''} news service as a resource for teaching and learning {J}apanese: An assessment of the comprehension difficulty of {J}apanese sentence-end expressions,2015,"""news web easy"" news service, teaching, learning japanese, evaluate, comprehension, entity morphs",0
Grammatical Error Correction Considering Multi-word Expressions,2015,"linguistic error correction, multiword expressions",1
Salinlahi {III}: An Intelligent Tutoring System for {F}ilipino Heritage Language Learners,2015,"salinlahi iii, intelligent tutoring system, filipino",0
Using Finite State Transducers for Helping Foreign Language Learning,2015,"finite state transducers, private language learning",1
{C}hinese Grammatical Error Diagnosis Using Ensemble Learning,2015,"chinese grammar, diagnose, ensemble learning",18
Condition Random Fields-based Grammatical Error Detection for {C}hinese as Second Language,2015,"condition random fields, grammar error detection, chinese as second language",7
Improving {C}hinese Grammatical Error Correction with Corpus Augmentation and Hierarchical Phrase-based Statistical Machine Translation,2015,"chinese grammar, semantic maps, improve, hierarchical statistical machine translation",7
{C}hinese Grammatical Error Diagnosis System Based on Hybrid Model,2015,"chinese grammatical error diagnosis system, hybrid model",6
Proceedings of the Workshop on Noisy User-generated Text,2015,workshop on noisy user-generated text,0
Minority Language {T}witter: Part-of-Speech Tagging and Analysis of {I}rish Tweets,2015,"minority language, part-of-speech tagging, analysis, twittirish",26
Challenges of studying and processing dialects in social media,2015,"studies, process, dialect, social media",47
Toward Tweets Normalization Using Maximum Entropy,2015,"tweet, normalizer, maximum entropy",12
Five Shades of Noise: Analyzing Machine Translation Errors in User-Generated Text,2015,"noise, mt4all, user-generated text",10
A Normalizer for {UGC} in {B}razilian {P}ortuguese,2015,"normalizer, ugc, brazilian portuguese",8
{USFD}: {T}witter {NER} with Drift Compensation and Linked Data,2015,"usfd, twitter ner, drift compensation, linked-data",12
{NRC}: Infused Phrase Vectors for Named Entity Recognition in {T}witter,2015,"nrc, infused phrase vectors, named entity learning, twitter",10
{IITP}: Multiobjective Differential Evolution based {T}witter Named Entity Recognition,2015,"iitp, multiobjective optimization, twitter, named entity learning",8
Data Adaptation for Named Entity Recognition on Tweets with Features-Rich {CRF},2015,"data adaptation, named entity learning, tweet, features-rich crf",2
{H}allym: Named Entity Recognition on {T}witter with Word Representation,2015,"hallym, named entity learning, twitter, word representation",6
{IHS}{\_}{RD}: Lexical Normalization for {E}nglish Tweets,2015,"ihs_rd, lexical normalisation, #tweets",13
{B}ekli:A Simple Approach to {T}witter Text Normalization.,2015,"bekli, simple method, social text normalization",14
{NCSU}-{SAS}-Ning: Candidate Generation and Feature Engineering for Supervised Lexical Normalization,2015,"ncsu, candidate generation, nepali social media, supervised lexical substitution",24
{DCU}-{ADAPT}: Learning Edit Operations for Microblog Normalisation with the Generalised Perceptron,2015,"dcu-adapt, edit operations, microblog normalisation, generalised perceptron",4
{LYSGROUP}: Adapting a {S}panish microtext normalization system to {E}nglish.,2015,"lysgroup, spanish microtext normalization, english",8
{IITP}: Hybrid Approach for Text Normalization in {T}witter,2015,"iitp, hybrid approach, text smoothing, twitter",15
{NCSU}{\_}{SAS}{\_}{WOOKHEE}: A Deep Contextual Long-Short Term Memory Model for Text Normalization,2015,"deep long short-memory models, text smoothing",24
{USZEGED}: Correction Type-sensitive Normalization of {E}nglish Tweets Using Efficiently Indexed n-gram Statistics,2015,"uszeged, correction type-sensitive normalization, #tweets, n-gram analytics",8
Shared Tasks of the 2015 Workshop on Noisy User-generated Text: {T}witter Lexical Normalization and Named Entity Recognition,2015,"2015 workshop on noisy user-generated text, cultural cues, named entity learning",152
Enhancing Named Entity Recognition in {T}witter Messages Using Entity Linking,2015,"named entity learning, twitter messages, entity linkage",31
Improving {T}witter Named Entity Recognition using Word Representations,2015,"twitter, named entity learning, word representation",14
Multimedia Lab @ {ACL} {WNUT} {NER} Shared Task: Named Entity Recognition for {T}witter Microposts using Distributed Word Representations,2015,"multimedia lab, acl wnut ner shared task, named entity learning, twitter microposts, distributed word models",175
{NCSU}{\_}{SAS}{\_}{SAM}: Deep Encoding and Reconstruction for Normalization of Noisy Text,2015,"ncsu, deep encoding, reconstruction, normalizer, noisy-text",15
Learning finite state word representations for unsupervised {T}witter adaptation of {POS} taggers,2015,"finite-state representation, unsupervised twitter adaptation, pos tagger",0
Towards {POS} Tagging for {A}rabic Tweets,2015,"pos tagging, arabic tweets",2
