Title,Year,Important Words,Citations
Driving {ROVER} with Segment-based {ASR} Quality Estimation,2015,"rover, segment-based asr quality estimation",15
A Hierarchical Neural Autoencoder for Paragraphs and Documents,2015,"hierarchical neural autoencoder, paragraphs, document",482
Joint Dependency Parsing and Multiword Expression Tokenization,2015,"joint dependency parsing, multiword expression filtering",31
End-to-end learning of semantic role labeling using recurrent neural networks,2015,"counterfactual, semantic case role, recurrent networks",279
Feature Optimization for Constituent Parsing via Neural Networks,2015,"optimized features, constituent syntax, neural nets",17
Identifying Cascading Errors using Constraints in Dependency Parsing,2015,"cascading errors, constraint, dependency parses",6
A Re-ranking Model for Dependency Parser with Recursive Convolutional Neural Network,2015,"reranking model, argument parser, combined convolutional neural network",40
Transition-based Neural Constituent Parsing,2015,"transition-based, neural constituent parsing",63
Feature Selection in Kernel Space: A Case Study on Dependency Parsing,2015,"feature selection, kernel space, casestudy, dependency parses",1
Semantic Role Labeling Improves Incremental Parsing,2015,"semantic case role, incremental parsing",5
Discontinuous Incremental Shift-reduce Parsing,2015,"discontinuity, buffered shift-reduce parsing",27
A Neural Probabilistic Structured-Prediction Model for Transition-Based Dependency Parsing,2015,"neural predictions, joint dependency parsing",85
Parsing Paraphrases with Joint Inference,2015,"parses, paraphrase, joint inference",7
Cross-lingual Dependency Parsing Based on Distributed Representations,2015,"cross-lingual dependency parsing, distributed representation",147
Can Natural Language Processing Become Natural Language Coaching?,2015,"natural language processing, natural language coaching",11
Machine Comprehension with Discourse Relations,2015,"machine comprehension, low-resource nmt",47
Implicit Role Linking on {C}hinese Discourse: Exploiting Explicit Roles and Frame-to-Frame Relations,2015,"implicit role binding, chinese discourse, explicit roles, frame relatedness",3
Discourse-sensitive Automatic Identification of Generic Expressions,2015,"discourse-aware, automatic identification, generic expressions",16
Model-based Word Embeddings from Decompositions of Count Matrices,2015,"word embedding model, decompositions of count matrices",54
Entity Hierarchy Embedding,2015,"entity, hierarchy embedding",54
Orthogonality of Syntax and Semantics within Distributional Spaces,2015,"orthogonality, syntax, semantics, distributional space",11
Scalable Semantic Parsing with Partial Ontologies,2015,"agent-based approach, ontologies",31
Semantic Parsing via Staged Query Graph Generation: Question Answering with Knowledge Base,2015,"semantic parses, staged query graph generation, localising, knowledge bank",440
Building a Semantic Parser Overnight,2015,syntax parser,205
Predicting Polarities of Tweets by Composing Word Embeddings with Long Short-Term Memory,2015,"polarities of tweets, word embeddings, short-term memory",188
Topic Modeling based Sentiment Analysis on Social Media for Stock Market Prediction,2015,"topic modeling, sentiment analysis, social media, user study",115
Learning Tag Embeddings and Tag-specific Composition Functions in Recursive Neural Network,2015,"tag embeddings, composition functions, recursive neural network",54
A convex and feature-rich discriminative approach to dependency grammar induction,2015,"convex, feature-rich, grammar rule induction",19
Parse Imputation for Dependency Annotations,2015,"parse imputation, dependency annotation",8
Probing the Linguistic Strengths and Limitations of Unsupervised Grammar Induction,2015,"linguistic strengths, constraint, unsupervised formal grammar",13
Entity-Centric Coreference Resolution with Model Stacking,2015,"entity-centric coreference resolution, model stacking",143
Learning Anaphoricity and Antecedent Ranking Features for Coreference Resolution,2015,"learn, anaphoricity, antecedent ranking features, coreference decisions",105
Transferring Coreference Resolvers with Posterior Regularization,2015,"coreference resolvers, posterior regularization",16
Tea Party in the House: A Hierarchical Ideal Point Topic Model and Its Application to Republican Legislators in the 112th Congress,2015,"tea party, hierarchical topic model, veridicality, 112th congress",42
"{KB}-{LDA}: Jointly Learning a Knowledge Base of Hierarchy, Relations, and Facts",2015,"kb-lda, knowledge bank, hierarchy, relation, fact",14
A Computationally Efficient Algorithm for Learning Topical Collocation Models,2015,"computationally feasible, learn, numeric attributes",2
Compositional Semantic Parsing on Semi-Structured Tables,2015,"compositional semantic parser, semi-structured data",263
Graph parsing with s-graph grammars,2015,"graph parsing, s-graph grammars",27
Sparse Overcomplete Word Vector Representations,2015,sparse text patterns,134
Learning Semantic Word Embeddings based on Ordinal Knowledge Constraints,2015,"semantic word embeddings, ordinal knowledge constraints",116
Adding Semantics to Data-Driven Paraphrasing,2015,"semantics, discourse resource",53
Parsing as Reduction,2015,"parses, reducts",44
Optimal Shift-Reduce Constituent Parsing with Structured Perceptron,2015,"shift-reduce, constituent syntax, structured perceptron",10
"A Data-Driven, Factorization Parser for {CCG} Dependency Structures",2015,"data-driven, factorization parser, ccg structures",10
Improved Semantic Representations From Tree-Structured Long Short-Term Memory Networks,2015,"pedagogical spell, tree-structured long short-term memory",2081
gen{CNN}: A Convolutional Architecture for Word Sequence Prediction,2015,"gencnn, convolutional architecture, semantic sequences",19
Neural Responding Machine for Short-Text Conversation,2015,"neural responding machine, small talk",832
Abstractive Multi-Document Summarization via Phrase Selection and Merging,2015,"abstractive multi-document summarization, phrase selection, merging",104
Joint Graphical Models for Date Selection in Timeline Summarization,2015,"cross-graph model, date selection, chart summarization",17
Predicting Salient Updates for Disaster Summarization,2015,"salient reviews, disaster summarization",47
Unsupervised Prediction of Acceptability Judgements,2015,"konceptuelle grafer, acceptability judgments",32
A Frame of Mind: Using Statistical Models for Detection of Framing and Agenda Setting Campaigns,2015,"statistic models, detecting, framing, agenda setting campaigns",67
Why discourse affects speakers{'} choice of referring expressions,2015,"discourse, speakers, relative pronouns",21
Linguistic Harbingers of Betrayal: A Case Study on an Online Strategy Game,2015,"linguistic harbingers of betrayal, ccg parser",23
Who caught a cold ? - Identifying the subject of a symptom,2015,"cold, subject of a symptom",13
Weakly Supervised Role Identification in Teamwork Interactions,2015,"weakly supervised, identity, teamwork",17
Deep Unordered Composition Rivals Syntactic Methods for Text Classification,2015,"deep unordered composition, syntactic methods, text classification",571
{SOLAR}: Scalable Online Learning Algorithms for Ranking,2015,"solar, scalable online training, ranking",11
Text Categorization as a Graph Classification Problem,2015,"classifying texts, error classification",59
Inverted indexing for cross-lingual {NLP},2015,"inverted index, cross-lingual nlp (natural language processing)",81
Multi-Task Learning for Multiple Language Translation,2015,"multi-task feature, multilingual email",365
Accurate Linear-Time {C}hinese Word Segmentation via Embedding Matching,2015,"linear-time, chronus system, embedding matching",32
Gated Recursive Neural Network for {C}hinese Word Segmentation,2015,"teamwork, chronus system",94
An analysis of the user occupational class through {T}witter content,2015,"user occupational class, twitter context",161
Tracking unbounded Topic Streams,2015,"unbounded topic streams, track",7
Inducing Word and Part-of-Speech with {P}itman-{Y}or Hidden Semi-{M}arkov Models,2015,"word, part-of-speech, pitman-yor semi-markov model",17
Coupled Sequence Labeling on Heterogeneous Annotations: {POS} Tagging as a Case Study,2015,"coupled sequence labeling, homogeneous annotations, pos tagging, casestudy",21
{A}uto{E}xtend: Extending Word Embeddings to Embeddings for Synsets and Lexemes,2015,"word embeddings, multi-view, synset, lexemes",240
Improving Evaluation of Machine Translation Quality Estimation,2015,"evaluate, machine translation quality estimation",38
Proceedings of the 27th Conference on Computational Linguistics and Speech Processing ({ROCLING} 2015),2015,"27th conference on computational linguistics and speech processing, rocling 2015",0
WgZ(A Study on Representation Learning Techniques for Extractive Spoken Document Summarization) [In {C}hinese],2015,"representation learning, extractive document summarization",0
~cY~BmZRZ{m(Exploring Word Embedding and Concept Information for Language Model Adaptation in {M}andarin Large Vocabulary Continuous Speech Recognition) [In {C}hinese],2015,"word embedding, concept information, language model adaptation, mandarin, large-vocabulary continuous speech recognition",0
YxcDx(Monaural Source Separation Using Nonnegative Matrix Factorization with Graph Regularization Constraint) [In {C}hinese],2015,"monaural source separation, nonnegative matrix factorization, graph regularization constraint",1
ZlZo{ (Smart Toneless {P}inyin Input Method for {H}akka Based on Natural Language Processing) [In {C}hinese],2015,"smart toneless pinyin input method, hakka, natural language processing",0
"cLWc(Textual Analysis of Complete Tang Poems for Discoveries and Applications - Style, Antitheses, Social Networks, and Couplets)[In {C}hinese]",2015,"textual analysis, complete tang poems, discovery, application, css, antitheses, social network, couplets",1
Designing a Tag-Based Statistical Math Word Problem Solver with Reasoning and Explanation,2015,"tag-based english math word problem solver, reasoning, explanation",10
Explanation Generation for a Math Word Problem Solver,2015,"explanation generation, math word problem solver",0
xAyWZnx(A Study of Readability Prediction on Elementary and Secondary {C}hinese Textbooks and Excellent Extracurricular Reading Materials) [In {C}hinese],2015,"readability prediction, elementary and secondary chinese textbooks, excellent extracurricular reading materials",3
Zc (A {B}ayesian approach to determine move tags in corpus) [In {C}hinese],2015,"bayesian approach, move tags, corpus",1
{lVZR(Several Refinements of Modulation Spectrum Factorization for Robust Speech Recognition) [In {C}hinese],2015,"refinement, modulation spectrum factorization, noise robust",1
NWWcgAZe`lzy(Exploring Combinations of Various Deep Neural Network based Acoustic Models and Classification Techniques for {M}andarin Mispro-nunciation Detection)[In {C}hinese],2015,"combinations, various deep neural network, acoustic model, classification method, mandarin mis-pronunciation detection",0
^ZBauy(Automating Behavior Coding for Distressed Couples Interactions Based on Stacked Sparse Autoencoder Framework using Speech-acoustic Features)[In {C}hinese],2015,"behavior codes, distressed couples interactions, stacked denoising autoencoder, child-produced speech",0
ZX(A Speech Enhancement System Based on Cerebellar Model Articulation Controller) [In {C}hinese],2015,"speech-enhanced, cerebellar model articulation controller",0
WYhyZR(Automatic Speech Recognition using Neural Network based Acoustic Model with the Environment Clustering and Mixture of Experts Algorithms) [In {C}hinese],2015,"automatic speech recognition, neural system, acoustic model, environment clustering, mixture of experts algorithms",0
QYWwR(A Tool for Web {NER} Model Generation Using Search Snippets of Known Entities) [In {C}hinese],2015,"web ner model, snippets, entity names",2
Word Co-occurrence Augmented Topic Model in Short Text,2015,"word cooccurrence, topic model, short text",1
 {W}ord2{V}ec ~Ww(Matching {I}nternet Mood Essays with Pop-Music Based on {W}ord2{V}ec)[In {C}hinese],2015,"word2vec, internet mood essays, pop-music",0
{W}ebcXcY(Points of Interest Extraction from Unstructured Web)[In {C}hinese],2015,"points d'intrt, unstructured web",0
\PPh}cl:hh}(Mining Issues of Public Concern by Association Analysis: Using Environmental Issue as an Example)[In {C}hinese],2015,"public concern, relation analysis, environmental issue",0
(New Editing and Checking Work of the Semantic Knowledge Base of Contemporary {C}hinese ({SKCC}))[In {C}hinese],2015,semantic memory,0
ZW(Analyzing Learners {`}Writing Fluency Based on Language Model)[In {C}hinese],2015,"learners, reading fluency, language model",1
The word complexity measure ({WCM}) in early phonological development: A longitudinal study from birth to three years old,2015,"word complexity measure (wcm), syntactic development, longitudinal study, birth, three years on",1
Learning Knowledge from User Search,2015,"knowledge, user search",0
ndAcAy(Analysis and Prediction of Blogger{'}s Depression Tendency)[In {C}hinese],2015,"blogger's depression tendency, analysis, predict",1
"Y{ANN}cExLEa(A Pitch-contour Generation Method Combining {ANN} Prediction,Global Variance Matching, and Real-contour Selection)[In {C}hinese]",2015,"pitch contour generation, ann prediction, global variance matching, real-contour selection",0
\{P}ythonYZRg(A Python Implementation of Automatic Speech-text Synchronization Using Speech Recognition and Text-to-Speech Technology)[In {C}hinese],2015,"python, event recognizer, speech recognition, end-to-end tts",0
YBZwR(Speech Emotion Recognition via Nonlinear Dynamical Features)[In {C}hinese],2015,"speech act recognition, non-linear features",1
Proceedings of the 2015 Conference of the North {A}merican Chapter of the Association for Computational Linguistics: Tutorial Abstracts,2015,"2015 conference, north american chapter, retrospection, paper abstract",0
Hands-on Learning to Search for Structured Prediction,2015,"hands-on learning, search, category name",0
Crowdsourcing for {NLP},2015,"crowdworkers, speakers' anger utterance",7
"The Logic of {AMR}: Practical, Unified, Graph-Based Sentence Semantics for {NLP}",2015,"amr, graph-based semantics, speakers' anger utterance, logic, unified",3
Deep Learning and Continuous Representations for Natural Language Processing,2015,"news, continuous representation, natural language processing",1
Social Media Predictive Analytics,2015,"social media, predictive model",6
Getting the Roles Right: Using {F}rame{N}et in {NLP},2015,"role, framenet, speakers' anger utterance",4
Proceedings of the 2015 Conference of the North {A}merican Chapter of the Association for Computational Linguistics: Demonstrations,2015,"2015 conference, north american chapter, retrospection, worry",0
Two Practical {R}hetorical {S}tructure {T}heory Parsers,2015,rhetorical structure parsing,75
Analyzing and Visualizing Coreference Resolution Errors,2015,"analyses, visualizing, coreference decisions",10
"hyp: A Toolkit for Representing, Manipulating, and Optimizing Hypergraphs",2015,"hyp, toolkit, representing, manipulating, optimizing, hypergraphs",0
Enhancing Instructor-Student and Student-Student Interactions with Mobile Interfaces and Summarization,2015,"syntactic flexibility, syntactic flexibility, mobile interfaces, summarization",14
{RE}xtractor: a Robust Information Extractor,2015,"rextractor, term extractor",8
"An {AMR} parser for {E}nglish, {F}rench, {G}erman, {S}panish and {J}apanese and a new {AMR}-annotated corpus",2015,"amr parser, english, french, german, spanish, japanese, amr-annotated corpus",40
{ICE}: Rapid Information Extraction Customization for {NLP} Novices,2015,"ice, lexical composition, customizing, speakers' anger utterance, novice",16
{AMRICA}: an {AMR} Inspector for Cross-language Alignments,2015,"amrica, amr inspector, cross-lingual alignment",9
{C}kylark: A More Robust {PCFG}-{LA} Parser,2015,"ckylark, pcfg parsing",15
{ELCO}3: Entity Linking with Corpus Coherence Combining Open Source Annotators,2015,"elco3, entity linkage, corpus coherence, open source annotators",2
{SETS}: Scalable and Efficient Tree Search in Dependency Graphs,2015,"set, scalable, efficient tree search, dependency graph",12
Visualizing Deep-Syntactic Parser Output,2015,"deep-syntactic parsing, visualizing",1
{WOLFE}: An {NLP}-friendly Declarative Machine Learning Stack,2015,"wolfe, speakers' anger utterance, declarative machine learning stack",2
Lean Question Answering over {F}reebase from Scratch,2015,"lean question answering, freebase, scratch",60
A Web Application for Automated Dialect Analysis,2015,"web app, automated dialect analysis",16
An Open-source Framework for Multi-level Semantic Similarity Measurement,2015,"open-source framework, semantic metrics",3
Brahmi-Net: A transliteration and script conversion system for languages of the {I}ndian subcontinent,2015,"brahmi-net, transliteration, text conversion system, languages, indian subcontinent",23
A Concrete {C}hinese {NLP} Pipeline,2015,chinese nlp,2
{C}ro{V}e{WA}: Crosslingual Vector-Based Writing Assistance,2015,"crovewa, crosslingual vector-based writing assistance",2
Online Readability and Text Complexity Analysis with {T}ext{E}valuator,2015,"web readability, text complexity, textevaluator",16
Natural Language Question Answering and Analytics for Diverse and Interlinked Datasets,2015,"natural language questions, analytics, diverse dataset, interlinked datasets",12
{W}rite{A}head2: Mining Lexical Grammar Patterns for Assisted Writing,2015,"writeahead2, mining, generation-distillation, assisted writing",8
Question Answering System using Multiple Information Source and Open Type Answer Merge,2015,"transcheck system, source of knowledge, open type answer merge",7
Using Word Semantics To Assist {E}nglish as a Second Language Learners,2015,"verb semantic, medieval arabic literature",9
Proceedings of the 2015 Conference of the North {A}merican Chapter of the Association for Computational Linguistics: Student Research Workshop,2015,"2015 conference, north american chapter, retrospection, student research workshop",0
Cache-Augmented Latent Topic Language Models for Speech Retrieval,2015,"cache-augmented latent topic language models, speech retrieval",0
Reliable Lexical Simplification for Non-Native Speakers,2015,"lexical simplifier, wmt18",26
Analyzing Newspaper Crime Reports for Identification of Safe Transit Paths,2015,"newspaper crime reports, identity, safe transit paths",8
Relation extraction pattern ranking using word similarity,2015,"relation extraction, patternrank, word similarity",1
Towards a Better Semantic Role Labeling of Complex Predicates,2015,"semantic case role, complex predicates",4
Exploring Relational Features and Learning under Distant Supervision for Information Extraction Tasks,2015,"related attributes, distant supervision, information extraction task",0
Entity/Event-Level Sentiment Detection and Inference,2015,"entity, event-level sentiment detection, inference",3
Initial Steps for Building a Lexicon of Adjectives with Scalemates,2015,"lexicon, adjectives, scalemates",0
A Preliminary Evaluation of the Impact of Syntactic Structure in Semantic Textual Similarity and Semantic Relatedness Tasks,2015,"pre-evaluation, impact, syntactic structure, semantic text similarity, averaging",1
Benchmarking Machine Translated Sentiment Analysis for {A}rabic Tweets,2015,"machine translated text detection, arabic tweets, benchmarking",18
Learning Kernels for Semantic Clustering: A Deep Approach,2015,"learning kernels, 22e \'edition), deep approach",3
Narrowing the Loop: Integration of Resources and Linguistic Dataset Development with Interactive Machine Learning,2015,"glossectomised patients, linguistic dataset development, interactive machine learning",4
Relation Extraction from Community Generated Question-Answer Pairs,2015,"relation extraction, franais (french)",10
Detecting Translation Direction: A Cross-Domain Study,2015,"translation direction, cross-domain study",5
Improving the Translation of Discourse Markers for {C}hinese into {E}nglish,2015,"translate, discourse marking, chinese, english",8
Discourse and Document-level Information for Evaluating Language Output Tasks,2015,"discourse, document-level information, evaluating language output tasks",6
Speeding Document Annotation with Topic Models,2015,"document annotation, topic model",0
Lifelong Machine Learning for Topic Modeling and Beyond,2015,"lifelong machine learning, topic modeling",5
Semantics-based Graph Approach to Complex Question-Answering,2015,"semantics, graph approach, complex question-answering",2
Recognizing Textual Entailment using Dependency Analysis and Machine Learning,2015,"textual entailment, dependency analysis, machine-learning",7
Bilingual lexicon extraction for a distant language pair using a small parallel corpus,2015,"bilingual lexica, extraction, distant language pair, small parallel corpus",6
Morphological Paradigms: Computational Structure and Unsupervised Learning,2015,"linguistic paradigms, computational structure, unsupervised learner",4
Computational Exploration to Linguistic Structures of Future: Classification and Categorization,2015,"computational exploration, linguistic structures, future, classification, categorize",2
Proceedings of the 2015 Conference of the North {A}merican Chapter of the Association for Computational Linguistics: Human Language Technologies,2015,"2015 conference, north american chapter, retrospection, human language technologies",0
Unsupervised Induction of Semantic Roles within a Reconstruction-Error Minimization Framework,2015,"unsupervised induction, semantic roles, reconstruction-error minimization framework",27
Predicate Argument Alignment using a Global Coherence Model,2015,"predicate argument aligner, global coherence",7
Improving unsupervised vector-space thematic fit evaluation via role-filler prototype clustering,2015,"unsupervised vector-space, thematic fit, role-filler prototype clustering",24
A Compositional and Interpretable Semantic Space,2015,"compositional, interpretable semantic space",53
"Randomized Greedy Inference for Joint Segmentation, {POS} Tagging and Dependency Parsing",2015,"greedy inference, joint segmentation, pos tagging, dependency parses",33
An Incremental Algorithm for Transition-based {CCG} Parsing,2015,"iterative search, span-based ccg parsing",15
Because Syntax Does Matter: Improving Predicate-Argument Structures Parsing with Syntactic Features,2015,"syntax, multi-encoder, psychology",11
A Hybrid Generative/Discriminative Approach To Citation Prediction,2015,"hybrid generative approach, citation prediction",2
Weakly Supervised Slot Tagging with Partially Labeled Sequences from Web Search Click Logs,2015,"few-shot scene, partially labeled data, search click logs",28
Not All Character N-grams Are Created Equal: A Study in Authorship Attribution,2015,"character n-grams, authorship",124
Effective Use of Word Order for Text Categorization with Convolutional Neural Networks,2015,"word order, classifying texts, convolutional neural nets",686
Transition-Based Syntactic Linearization,2015,"transition-based, syntactic linearization",31
Extractive Summarisation Based on Keyword Profile and Language Model,2015,"extractive summarization, keyword profile, language model",6
{HEADS}: Headline Generation as Sequence Prediction Using an Abstract Feature-Rich Space,2015,"leading text, mapping table, abstract feature-rich space",39
"What{'}s Cookin{'}? Interpreting Cooking Videos using Text, Speech and Vision",2015,"cooking videos, text, speech, vision",107
Combining Language and Vision with a Multimodal Skip-gram Model,2015,"english, vision, skip-gram model",203
Discriminative Unsupervised Alignment of Natural Language Instructions with Corresponding Video Segments,2015,"unsupervised alignment, natural human commands, video segments",25
{T}opic{C}heck: Interactive Alignment for Assessing Topic Model Stability,2015,"topiccheck, interactive alignment, topic model",30
Inferring latent attributes of {T}witter users with label regularization,2015,"latent attributes, twitter ner, label regularization",21
A Neural Network Approach to Context-Sensitive Generation of Conversational Responses,2015,"neural system, context-sensitive generation, greater impact",698
How to Make a Frenemy: Multitape {FST}s for Portmanteau Generation,2015,"frenemy, multitape fsts, portmanteau creation",12
Aligning Sentences from Standard {W}ikipedia to {S}imple {W}ikipedia,2015,"sentences, simple wikipedia, simple wikipedia",68
Inducing Lexical Style Properties for Paraphrase and Genre Differentiation,2015,"lexical style, paraphrase, complex scenarios",40
Entity Linking for Spoken Language,2015,"entity linkage, spoken language",10
Spinning Straw into Gold: Using Free Text to Train Monolingual Alignment Models for Non-factoid Question Answering,2015,"free text, rescoring, non-factoid question",14
Personalized Page Rank for Named Entity Disambiguation,2015,"personalized page rank, representative sets",81
When and why are log-linear models self-normalizing?,2015,"compiler system, self-normalizing",39
Deep Multilingual Correlation for Improved Word Embeddings,2015,"multilingual correlation, word embeddings",127
Disfluency Detection with a Semi-{M}arkov Model and Prosodic Features,2015,"fluency filtering, semi-markov, prosodic patterns",36
Empty Category Detection With Joint Context-Label Embeddings,2015,"empty category detection, joint label embedding",3
Incrementally Tracking Reference in Human/Human Dialogue Using Linguistic and Extra-Linguistic Information,2015,"tracking reference, human/human dialogue, linguist content, extra-linguistic clues",9
